Date,Publisher,Publisher Code,Headline
2013-09-18,The Jakarta Post,JKPOST,"RI cautious as Fed starts meeting
Satria Sambijantoro, The Jakarta Post, Jakarta"
2013-09-19,The Jakarta Post,JKPOST,"Manpower minister backs down on wage cap  regulation 
Bagus BT Saragih, The Jakarta Post, Jakarta"
2013-09-19,LKBN ANTARA,ANTARA,"ECONOMIC NEWS
NATIONAL  ECONOMIC  UPHEAVAL TO RECEDE SOON: MINISTER"
2013-09-20,LKBN ANTARA,ANTARA,"ECONOMIC NEWS
ASIA PACIFIC REGION NEEDS STRUCTURAL REFORMS: WORLD BANK"
2013-09-20,LKBN ANTARA,ANTARA,"ECONOMIC NEWS
RI MUST BENEFIT FROM FEDS POSTPONEMENT OF FINANCIAL  STIMULUS  REDUCTION"
2013-09-21,The Jakarta Post,JKPOST,The global and regional  economic  outlook
2013-09-23,The Jakarta Post,JKPOST,Editorial: Siregar set for an uphill task
2013-09-24,The Jakarta Post,JKPOST,"Oil and gas firms no longer find home in Sumatra
Amahl S. Azwar, The Jakarta Post, Jakarta"
2013-09-27,LKBN ANTARA,ANTARA,"ECONOMIC NEWS
NEWS FOCUS - APEC AND CHALLENGES OF DEVELOPING TOURISM IN INDONESIA BY AZI FITRIYANTI"
2013-10-02,LKBN ANTARA,ANTARA,"ECONOMIC NEWS
TOURISM MAJOR GROWTH DRIVER IN ASIA-PACIFIC REGION: MINISTER"
2013-10-02,LKBN ANTARA,ANTARA,"ECONOMIC NEWS
PRESIDENT URGED TO SIGN  ECONOMIC POLICY  PACKAGES"
2013-10-02,LKBN ANTARA,ANTARA,"ECONOMIC NEWS
BI RENEWS BILATERAL SWAP WITH CHINESE COUNTERPART"
2013-10-02,LKBN ANTARA,ANTARA,"ECONOMIC NEWS
BI HOPES EXTENSION OF SWAP AGREEMENT WILL BOOST MARKET CONFIDENCE"
2013-10-04,The Jakarta Post,JKPOST,"Study claims US is Indonesia's largest foreign investor
Anggi M. Lubis, The Jakarta Post, Jakarta"
2013-10-05,The Jakarta Post,JKPOST,"WB projects slower GDP growth for RI
Tassia Sipahutar, The Jakarta Post, Jakarta"
2013-10-07,The Jakarta Post,JKPOST,RI's credibility tested by Mining Law enforcement: Deripaska
2013-10-09,LKBN ANTARA,ANTARA,"ECONOMIC NEWS
RUPIAH DOWN IN VALUE AGAINST DOLLAR, INDEX UP"
2013-10-09,The Jakarta Post,JKPOST,"Govt,  central bank  more optimistic than IMF
Raras Cahyafitri and Tassia Sipahutar, The Jakarta Post, Jakarta"
2013-10-12,The Jakarta Post,JKPOST,University contribution to APEC connectivity
2013-10-13,LKBN ANTARA,ANTARA,"ECONOMIC NEWS
INDONESIA, SOUTH KOREA AGREE TO SIGN CURRENCY SWAP DEAL"
2013-10-14,The Jakarta Post,JKPOST,"Labor,  policy  issues loom large over Batam
Fadli, The Jakarta Post, Batam"
2013-10-14,LKBN ANTARA,ANTARA,"ECONOMIC NEWS
NEWS FOCUS - RI TURNS TO SWAP DEALS TO BOLSTER FINANCIAL SYSTEM"
2013-10-14,Tempo.co,TEMPOE,Indonesia Eximbank CEO: Everything Needs to be Maintained
2013-10-16,LKBN ANTARA,ANTARA,"ECONOMIC NEWS
INDONESIA SIGNS SWAP AGREEMENTS TO BOOST MARKET CONFIDENCE: DEPUTY MINISTER"
2013-10-17,The Jakarta Post,JKPOST,"House may force govt to stop dawdling on oil lease extensions
Amahl S. Azwar, The Jakarta Post, Jakarta"
2013-10-21,The Jakarta Post,JKPOST,"BI reinforces foreign exchange  reserves  defense
Satria Sambijantoro  , The Jakarta Post, Jakarta"
2013-10-23,The Jakarta Post,JKPOST,"Foreign fund inflows drive strong rally in RI bonds
Satria Sambijantoro, The Jakarta Post, Jakarta"
2013-10-24,The Jakarta Post,JKPOST,"Indonesia investments stand tall despite market turbulence
Satria Sambijantoro, The Jakarta Post, Jakarta"
2013-10-25,The Jakarta Post,JKPOST,Analysis: Property market outlook still buoyant despite currency volatility
2013-10-27,The Jakarta Post,JKPOST,The week in review: Money and stability
2013-10-28,LKBN ANTARA,ANTARA,"ECONOMIC NEWS
RUPIAH FALLS 72 POINTS TO RP11,073/DOLLAR MONDAY EVENING"
2013-10-28,LKBN ANTARA,ANTARA,"ECONOMIC NEWS
INDONESIAS  ECONOMY  TO IMPROVE IN 2014: BI GOVERNOR"
2013-10-28,The Jakarta Post,JKPOST,"Govt aims to fund committed mining firms
Raras Cahyafitri  , The Jakarta Post, Jakarta"
2013-10-31,The Jakarta Post,JKPOST,Editorial: A game of brinkmanship
2013-11-04,LKBN ANTARA,ANTARA,"ECONOMIC NEWS
PRESIDENT HOLDS MEETING WITH KADIN ADMINISTRATORS"
2013-11-07,The Jakarta Post,JKPOST,"Door widens for foreign investors
Satria Sambijantoro, The Jakarta Post, Jakarta"
2013-11-08,The Jakarta Post,JKPOST,"Govt warned to avoid 'nationalistic'  economic  policies
Satria Sambijantoro, The Jakarta Post, Jakarta"
2013-11-08,The Jakarta Post,JKPOST,"FDI growth set to fall below 20% next year
Tassia Sipahutar, The Jakarta Post, Jakarta"
2013-11-08,Tempo.co,TEMPOE,World  Bank : Indonesia  will Overcome  Economic  pressures
2013-11-13,The Jakarta Post,JKPOST,"US companies urged to invest outside Java
Linda Yulisman, The Jakarta Post, Jakarta"
2013-11-13,The Jakarta Post,JKPOST,Reform fatigue amid decelerating  economic  growth
2013-11-16,The Jakarta Post,JKPOST,"|  
New mining  policy , faces old problems
Raras Cahyafitri, The Jakarta Post, Jakarta"
2013-11-18,LKBN ANTARA,ANTARA,"ECONOMIC NEWS
CHAMBER EXPECTS BI NOT TO RAISE ITS KEY RATE AGAIN"
2013-11-19,The Jakarta Post,JKPOST,Indonesia has fewest local investors
2013-11-20,The Jakarta Post,JKPOST,"Welcome to Indonesia, PM Rutte"
2013-11-26,The Jakarta Post,JKPOST,"More FDI vital to cover  deficit : BI
Satria Sambijantoro , The Jakarta Post, Jakarta"
2013-11-27,The Jakarta Post,JKPOST,BI dismisses concerns over sharp decline in rupiah
2013-11-29,LKBN ANTARA,ANTARA,"ECONOMIC NEWS
NO NEED TO PANIC OVER RUPIAHS TUMBLE AGAINST DOLLAR: BI"
2013-11-29,The Jakarta Post,JKPOST,"Business confidence of British firms in RI tumbles
Linda Yulisman, The Jakarta Post, Jakarta"
2013-11-30,LKBN ANTARA,ANTARA,"ECONOMIC NEWS
NEWS FOCUS -  PUBLIC  CALLED ON TO REMAIN CALM OVER RUPIAH DEPRECIATION"
2013-12-04,The Jakarta Post,JKPOST,Negotiating the non-negotiable
2013-12-04,The Jakarta Post,JKPOST,Climate finance: Slight hope and homework beyond the talks
2013-12-06,LKBN ANTARA,ANTARA,"ECONOMIC NEWS
INDONESIA TO ANNOUNCE SECOND PACKAGE OF  ECONOMIC  POLICIES"
2013-12-06,The Jakarta Post,JKPOST,"Indonesia wants to see end to QE tapering  uncertainty 
Satria Sambijantoro, The Jakarta Post, Jakarta"
2013-12-09,LKBN ANTARA,ANTARA,"ECONOMIC NEWS
INDONESIA COMMITTED TO WTO SUCCESS"
2013-12-09,The Jakarta Post,JKPOST,RI still attractive to Taiwanese and Japanese investors
2013-12-10,The Jakarta Post,JKPOST,Rebalancing WTO's 'development dimension'
2013-12-10,LKBN ANTARA,ANTARA,"ECONOMIC NEWS
PRESIDENT CALLS FOR PROPER, TRANSPARENT USE OF BUDGETARY FUNDS"
2013-12-12,LKBN ANTARA,ANTARA,"ECONOMIC NEWS
 BANK INDONESIA  FEELS RUPIAH STILL UNDER PRESSURE"
2013-12-14,The Jakarta Post,JKPOST,"Reform or stagnate, RI warned
Satria Sambijantoro, The Jakarta Post, Nusa Dua, Bali"
2013-12-14,The Jakarta Post,JKPOST,"BI doubles forex swap with Japan to $22.7 billion
Satria Sambijantoro, The Jakarta Post, Nusa Dua, Bali"
2013-12-17,The Jakarta Post,JKPOST,Fighting graft: No (unlawful) gain without pain
2013-12-19,The Jakarta Post,JKPOST,Regulated gas prices put the domestic supply at risk
2013-12-19,LKBN ANTARA,ANTARA,"ECONOMIC NEWS
BI: THE FEDS  STIMULUS  TAPERING POSITIVE"
2013-12-20,The Jakarta Post,JKPOST,"Apindo foresees lower  economic  growth in 2014
Anggi M. Lubis, The Jakarta Post, Jakarta"
2013-12-21,The Jakarta Post,JKPOST,Building urban resilience
2013-12-21,LKBN ANTARA,ANTARA,"ECONOMIC NEWS
YEAR ENDER - 2013 STATE  EXPENDITURE  EXPECTED TO REACH 96 PCT"
2013-12-23,The Jakarta Post,JKPOST,"Fed rate outlook brings relief to Indonesia
Satria Sambijantoro, The Jakarta Post, Jakarta"
2013-12-26,The Jakarta Post,JKPOST,"Govt raises foreign ownership limit
Satria Sambijantoro, The Jakarta Post, Jakarta"
2013-12-27,LKBN ANTARA,ANTARA,"ECONOMIC NEWS
YEAR ENDER - RI FALLS SHORT OF CPO PRODUCTION TARGET"
2013-12-28,The Jakarta Post,JKPOST,"Outlook: M&A market to chill in 2014, re-balance high valuations
Mariel Grazella , The Jakarta Post, Jakarta"
2013-12-28,The Jakarta Post,JKPOST,"Govt predicts modest growth despite DNI revision
Satria Sambijantoro  , The Jakarta Post, Jakarta"
2014-01-02,The Jakarta Post,JKPOST,"Double-edged sword of elections on  economy 
Satria Sambijantoro, The Jakarta Post, Jakarta"
2014-01-04,The Jakarta Post,JKPOST,"As ban looms, ore production to fall and big miners' fate  uncertain 
Raras Cahyafitri, The Jakarta Post, Jakarta"
2014-01-04,The Jakarta Post,JKPOST,HK advises RI not to focus on rankings
2014-01-07,The Jakarta Post,JKPOST,"After record sales surge, car producers bracing for soft landing
Linda Yulisman , The Jakarta Post, Jakarta"
2014-01-08,The Jakarta Post,JKPOST,"Marty will use remainder of term to cement RI's global role
Bagus BT Saragih, The Jakarta Post, Jakarta"
2014-01-10,LKBN ANTARA,ANTARA,"ECONOMIC NEWS
BI GOVERNOR PREDICTS STRONGER  ECONOMIC  GROWTH IN 2014"
2014-01-13,The Jakarta Post,JKPOST,"Pipeline construction sluggish as gas use grows
Raras Cahyafitri  , The Jakarta Post, Jakarta"
2014-01-14,LKBN ANTARA,ANTARA,"ECONOMIC NEWS
MARKET SHOWS POSITIVE RESPONSE TO BAN ON MINERAL ORE EXPORT"
2014-01-19,The Jakarta Post,JKPOST,"View Point: Unnecessary confusion in enforcing the 2009 Mining Law
Vincent Lingga, The Jakarta Post, Jakarta"
2014-01-21,LKBN ANTARA,ANTARA,"ECONOMIC NEWS
INDONESIAS  ECONOMY  STABLE IN 2014: CHIEF  ECONOMIC  MINISTER"
2014-01-22,The Jakarta Post,JKPOST,"New refineries attract massive investment
Satria Sambijantoro, The Jakarta Post, Jakarta"
2014-01-23,The Jakarta Post,JKPOST,"RI's foreign debt lower on  economic  slowdown
Tassia Sipahutar, The Jakarta Post, Jakarta"
2014-01-27,The Jakarta Post,JKPOST,"Discourse: Election year projects RI's strengthening democracy, says Marty"
2014-01-27,The Jakarta Post,JKPOST,Editorial: Investment still brisk
2014-01-28,The Jakarta Post,JKPOST,Regulation  may dash palm oil industry's hopes for higher output
2014-02-06,The Jakarta Post,JKPOST,"Exports,  spending  prop up  economy 
Satria Sambijantoro, The Jakarta Post, Jakarta"
2014-02-06,The Jakarta Post,JKPOST,"Analysis: GDP growth: More acceleration expected to occur in second half, this year"
2014-02-07,The Jakarta Post,JKPOST,"Govt may start fixed  subsidy  scheme this year
Satria Sambijantoro, The Jakarta Post, Jakarta"
2014-02-12,The Jakarta Post,JKPOST,"Bank Indonesia  to keep rate, maintain hawkish stance
Satria Sambijantoro, The Jakarta Post, Jakarta"
2014-02-13,The Jakarta Post,JKPOST,"The  economy  is improving, but is it sustainable?"
2014-02-13,The Jakarta Post,JKPOST,"Vale expects no increase in nickel output
Raras Cahyafitri, The Jakarta Post, Jakarta"
2014-02-14,LKBN ANTARA,ANTARA,"ECONOMIC NEWS
 DEFICIT  DOWN DUE TO INCREASING TRADE SURPLUS: BI"
2014-02-14,The Jakarta Post,JKPOST,Editorial: Legislating trade barriers
2014-02-17,LKBN ANTARA,ANTARA,"ECONOMIC NEWS
NEWMONT AWAITS CONCENTRATE EXPORT PERMIT"
2014-02-26,The Jakarta Post,JKPOST,Beyond Indonesia fashion week
2014-02-28,The Jakarta Post,JKPOST,Business means business even during election year
2014-03-03,The Jakarta Post,JKPOST,"Economic  stability in store for Dems to lure voters
Satria Sambijantoro , The Jakarta Post, Jakarta"
2014-03-04,The Jakarta Post,JKPOST,"RI upbeat despite trade loss
Satria Sambijantoro  , The Jakarta Post, Jakarta"
2014-03-04,The Jakarta Post,JKPOST,Indonesia's  economy  grows despite global turmoil
2014-03-10,LKBN ANTARA,ANTARA,"ECONOMIC NEWS
YUDHOYONO MEETS EDITOR-IN-CHIEF FORUM TO DISCUSS PRESIDENTIAL SUCCESSION"
2014-03-14,The Jakarta Post,JKPOST,Will you vote?
2014-03-14,The Jakarta Post,JKPOST,"BI keeps key rate same amid signs of  economic  recovery
Satria Sambijantoro, The Jakarta Post, Jakarta"
2014-03-17,The Jakarta Globe,JGLOBE,"Business
Foreign Debt Accelerates in January as Private Sector Seeks More Loans"
2014-03-17,The Jakarta Globe,JGLOBE,"Business
Mandiri Bullish on Underwriting"
2014-03-18,Tempo.co,TEMPOE,World  Bank : Indonesia Economy  to Grow 5.3 Percent
2014-03-21,The Jakarta Globe,JGLOBE,"Business
For Inpex, Gas Contract and Domestic Supply Linked"
2014-03-21,The Jakarta Post,JKPOST,"RI suffers as Fed sparks sell-off
Satria Sambijantoro and Tassia Sipahutar, The Jakarta Post, Jakarta"
2014-03-24,The Jakarta Post,JKPOST,Comments: RI shivering over Fed's interest  policy
2014-03-24,LKBN ANTARA,ANTARA,"ECONOMIC NEWS
RUPIAH GAINS AGAINST THE US DOLLAR"
2014-03-24,The Jakarta Globe,JGLOBE,"Business
Fresh Optimism Over  Economy"
2014-03-29,The Jakarta Post,JKPOST,How will Jokowi's policies shape up?
2014-03-31,The Jakarta Globe,JGLOBE,"Commentary
Defining Asia the Indo-Pacific Way"
2014-04-01,The Jakarta Post,JKPOST,"Weak rupiah clouds nationwide RFID project
Arya Dipa , The Jakarta Post, Bandung, West Java"
2014-04-03,The Jakarta Post,JKPOST,"Govt ignores industrial slowdown
Linda Yulisman and Satria Sambijantoro, The Jakarta Post, Jakarta"
2014-04-07,LKBN ANTARA,ANTARA,"ECONOMIC NEWS
INDONESIAS  ECONOMY  PREDICTED TO GROW 5.8 PERCENT IN FIRST QUARTER"
2014-04-08,The Jakarta Post,JKPOST,Quiet outlook for Indonesia's investment: WB
2014-04-09,The Jakarta Globe,JGLOBE,"Business
IMF Tempers Indonesias Growth Outlook"
2014-04-11,The Jakarta Post,JKPOST,"Investors disappointed with election result
Satria Sambijantoro, The Jakarta Post, Jakarta"
2014-04-11,Tempo.co,TEMPOE,JCI Shows Anomaly Post  Legislative  Election
2014-04-14,The Jakarta Post,JKPOST,Why is the market disappointed with the election results?
2014-04-21,The Jakarta Post,JKPOST,Challenges facing the Indonesian  economy
2014-04-21,The Jakarta Post,JKPOST,"'Wait-and-see' investors seek political clarity
Satria Sambijantoro , The Jakarta Post, Jakarta"
2014-04-24,Tempo.co,TEMPOE,Rupiah Weakens as China's  Economy  Slows Down
2014-04-25,The Jakarta Post,JKPOST,"FDI slows amid global  uncertainty 
Satria Sambijantoro, The Jakarta Post, Jakarta"
2014-04-26,The Jakarta Post,JKPOST,"Slower FDI growth in Q1 a short-term shock: Analysts
Satria Sambijantoro, The Jakarta Post, Jakarta"
2014-04-29,The Jakarta Post,JKPOST,Q1 tourism investment more than triples on improving  economy
2014-05-05,The Jakarta Post,JKPOST,Indonesia's election and  economic  prospects
2014-05-07,The Jakarta Post,JKPOST,"Govt maintains bullish outlook despite slowdown in first quarter
Satria Sambijantoro, The Jakarta Post, Jakarta"
2014-05-08,The Jakarta Post,JKPOST,"Analysis: Q1 result round-ups: The good, the bad and the ugly"
2014-05-08,The Jakarta Post,JKPOST,"IPA to hold 38th convention and exhibition
Benget Besalicto ST, The Jakarta Post,"
2014-05-10,The Jakarta Post,JKPOST,"RI enjoys $2.1b surplus in balance of payments
Satria Sambijantoro, The Jakarta Post, Jakarta"
2014-05-11,The Jakarta Post,JKPOST,Europe on Screen ends with delightful treats
2014-05-14,The Jakarta Post,JKPOST,The perils of export dependence on commodities
2014-05-20,The Jakarta Post,JKPOST,"Jokowi-Kalla gets market nod
Satria Sambijantoro and Margareth S. Aritonang  , The Jakarta Post, Jakarta"
2014-05-20,The Jakarta Post,JKPOST,"Locals' future  uncertain  after Sampoerna layoffs
Wahyoe Boediwardhana and Indra Harsaputra , The Jakarta Post, Lumajang, East Java"
2014-05-21,The Jakarta Post,JKPOST,"Cuts in  spending  leave infrastructure projects in limbo
Satria Sambijantoro, The Jakarta Post, Jakarta"
2014-05-21,The Jakarta Post,JKPOST,Editorial: Managing a weaker  economy
2014-05-21,The Jakarta Post,JKPOST,"Condominium sales up, other properties down
Anggi M. Lubis, The Jakarta Post, Jakarta"
2014-05-23,Tempo.co,TEMPOE,JCI Remains Unstable
2014-05-23,The Jakarta Post,JKPOST,"|  
The political  economy  of banning raw mineral exports"
2014-05-23,The Jakarta Post,JKPOST,Fuel  subsidy  issue awaits new govt
2014-05-23,The Jakarta Post,JKPOST,"Share prices gain, but JCI fails to return to 5,000-mark"
2014-05-26,The Jakarta Post,JKPOST,The  economic  landscape post-presidential election
2014-05-28,The Jakarta Post,JKPOST,"$12b Chevron project to get permit assistance
Khoirul Amin, The Jakarta Post, Jakarta"
2014-06-05,The Jakarta Post,JKPOST,Homework for the next president in the SSR agenda
2014-06-05,LKBN ANTARA,ANTARA,"ECONOMIC NEWS
NEWS FOCUS - NEXT PRESIDENT EXPECTED TO CONTINUE NUCLEAR PROGRAM BY OTNIEL TAMINDAEL"
2014-06-07,LKBN ANTARA,ANTARA,"ECONOMIC NEWS
NEWS FEATURE - RIS  ECONOMY  PREDICTED TO IMPROVE AFTER ELECTIONS"
2014-06-07,LKBN ANTARA,ANTARA,"ECONOMIC NEWS
SCB PREDICTS INCREASE IN  ECONOMIC  GROWTH IN 2015"
2014-06-08,The Jakarta Post,JKPOST,"View Point: Presidential candidates promise, but where will all the money come from?
Vincent Lingga, The Jakarta Post, Jakarta"
2014-06-11,The Jakarta Post,JKPOST,"Riau urged to ratify spatial plan to boost development
Rizal Harahap, The Jakarta Post, Pekanbaru"
2014-06-23,LKBN ANTARA,ANTARA,"ECONOMIC NEWS
LOCAL GOVERNMENTS OF EASTERN REGIONS ASKED TO WELCOME INVESTORS"
2014-06-25,The Jakarta Post,JKPOST,"Rp to stay at 12,000 per dollar
Satria Sambijantoro, The Jakarta Post, Jakarta"
2014-06-25,The Jakarta Post,JKPOST,What does revised 2014  budget  tell presidential candidates?
2014-06-26,The Jakarta Post,JKPOST,"Garuda gets hedging facility from BNI to cut forex loss
Tassia Sipahutar, The Jakarta Post, Jakarta"
2014-06-26,LKBN ANTARA,ANTARA,"ECONOMIC NEWS
TIGHT POLITICAL COMPETITION CAUSES RUPIAH DEPRECIATION: MINISTER"
2014-06-28,The Jakarta Post,JKPOST,"Prabowo victory bad for business: Global bankers
Satria Sambijantoro, The Jakarta Post, Jakarta"
2014-06-30,The Jakarta Post,JKPOST,Editorial: Regulatory inconsistency
2014-07-01,The Jakarta Post,JKPOST,Reviving Indonesia's export industry
2014-07-02,The Jakarta Post,JKPOST,Analysis: Textile industry; maximizing competitiveness opportunities
2014-07-04,The Jakarta Post,JKPOST,Future is green for Asian cities
2014-07-08,Tempo.co,TEMPOE,"Foreign Exchange  Reserves  Up on Oil, Gas Revenue"
2014-07-13,The Jakarta Post,JKPOST,New president and wetland data
2014-07-14,The Jakarta Post,JKPOST,Market euphoria over Jokowi: How long will it last?
2014-07-15,The Jakarta Post,JKPOST,Future oil and gas development: Some harsh realities
2014-07-16,The Jakarta Post,JKPOST,"BI warns of capital outflows
Satria Sambijantoro, The Jakarta Post, Jakarta"
2014-07-16,The Jakarta Post,JKPOST,Survival of climate action under new president
2014-07-16,The Jakarta Post,JKPOST,BCA warns of worse than expected slowdown in lending
2014-07-23,The Jakarta Post,JKPOST,OUR SEVENTH PRESIDENT
2014-07-24,The Jakarta Post,JKPOST,"Jokowi gets warm welcome from financial market
Satria Sambijantoro, The Jakarta Post, Jakarta"
2014-07-25,The Jakarta Post,JKPOST,"Mining Law boosts foreign investment
Satria Sambijantoro, The Jakarta Post, Jakarta"
2014-07-25,The Jakarta Post,JKPOST,Editorial: Jokowi's first market test
2014-07-29,LKBN ANTARA,ANTARA,"ECONOMIC NEWS
INVESTORS AWAITING FINAL DECISION ON PRESIDENTIAL ELECTION"
2014-07-31,The Jakarta Post,JKPOST,"Jokowi's policies likely to attract investments
Satria Sambijantoro, The Jakarta Post, Jakarta"
2014-08-05,The Jakarta Post,JKPOST,"Inflation stays benign in the month of Idul Fitri
Satria Sambijantoro  , The Jakarta Post, Jakarta"
2014-08-06,The Jakarta Post,JKPOST,"Stocks drop as GDP data disappoints, market prospects still good
Tama Salim , The Jakarta Post, Jakarta"
2014-08-14,The Jakarta Post,JKPOST,Editorial: In for austere  budget
2014-08-16,The Jakarta Post,JKPOST,"BOP in surplus despite current account  deficit 
Khoirul Amin, The Jakarta Post, Jakarta"
2014-08-19,The Jakarta Post,JKPOST,A half-baked  budget  for president-elect Joko Widodo
2014-08-19,The Jakarta Post,JKPOST,"New banknotes launched, redenomination will go on
Satria Sambijantoro, The Jakarta Post, Jakarta"
2014-08-22,The Jakarta Post,JKPOST,"Shares, rupiah gain as Prabowo rejected
Satria Sambijantoro  and Linda Yulisman, The Jakarta Post, Jakarta"
2014-08-23,The Jakarta Post,JKPOST,"Rupiah rallies to three-week high
Tassia Sipahutar, The Jakarta Post, Jakarta"
2014-08-26,The Jakarta Post,JKPOST,"BI vigilant as bankers take divergent paths
Satria Sambijantoro  , The Jakarta Post, Jakarta"
2014-08-28,LKBN ANTARA,ANTARA,"ECONOMIC NEWS
RUPIAH DOWN 11 POINTS ON THURSDAY EVENING"
2014-08-30,The Jakarta Post,JKPOST,"BI warns of risks of subsidized fuel
Satria Sambijantoro, The Jakarta Post, Jakarta"
2014-08-30,LKBN ANTARA,ANTARA,"ECONOMIC NEWS
GOVERNMENT URGED TO BE FIRM IN FUEL  POLICY"
2014-09-03,The Jakarta Post,JKPOST,An abdication of responsibility
2014-09-03,The Jakarta Post,JKPOST,"Analysis: A view on the Indonesian  economy : Past, present & future"
2014-09-03,LKBN ANTARA,ANTARA,"ECONOMIC NEWS
EXTERNAL, INTERNAL FACTORS PREDICTED TO CONTRIBUTE TO  ECONOMIC  GROWTH"
2014-09-06,The Jakarta Post,JKPOST,Ensuring broadband connectivity: A mounting task for Jokowi
2014-09-06,LKBN ANTARA,ANTARA,"ECONOMIC NEWS
NEWS FEATURE - PROSPECT OF INDONESIAN CPO REMAINS BRIGHT"
2014-09-08,The Jakarta Post,JKPOST,"Resolving oil, gas supply barriers"
2014-09-16,The Jakarta Post,JKPOST,"BI maintains  policy  stance, still wary of fuel price, US rate
Satria Sambijantoro, The Jakarta Post, Jakarta"
2014-09-18,The Jakarta Post,JKPOST,Roadmap to  economic  prosperity
2014-09-18,The Jakarta Post,JKPOST,SBY  economic  legacy will cloud Jokowi's prospects
2014-09-18,The Jakarta Post,JKPOST,Economic  challenges for the new government
2014-09-20,The Jakarta Post,JKPOST,Jokowi promises to make RI better place for investors
2014-09-24,The Jakarta Post,JKPOST,"Diplomacy,  economy  and welfare"
2014-09-24,The Jakarta Post,JKPOST,"BI rate can stay at 7.5% despite fuel price hike
Satria Sambijantoro   and Bagus BT Saragih, The Jakarta Post, Jakarta"
2014-09-26,The Jakarta Post,JKPOST,"Budget deficit  limit too low; needs to change
Satria Sambijantoro, The Jakarta Post, Jakarta"
2014-10-03,LKBN ANTARA,ANTARA,"ECONOMIC NEWS
INDONESIAN MACROECONOMIC STABILITY MUST BE MAINTAINED: DEPUTY MINISTER"
2014-10-04,The Jakarta Post,JKPOST,"Stock, rupiah continue to flag amid political tension
Khoirul Amin and  Anggi M. Lubis, The Jakarta Post, Jakarta"
2014-10-06,The Jakarta Post,JKPOST,Editorial: On the precipice
2014-10-07,The Jakarta Post,JKPOST,"RI to see higher growth in 2015: WB
Tassia Sipahutar  , The Jakarta Post, Jakarta"
2014-10-10,The Jakarta Post,JKPOST,Reinstating 'negara hukum': A new challenge (Part 2 of 2)
2014-10-12,The Jakarta Post,JKPOST,"Gov't says BDF will return after SBY's exit, despite critics
Desy Nurhayati, The Jakarta Post, Nusa Dua, Bali"
2014-10-15,The Jakarta Post,JKPOST,"Lagging infrastructure clouds SBY's rich  economic  legacy
Satria Sambijantoro  , The Jakarta Post, Jakarta"
2014-10-15,Tempo.co,TEMPOE,"Rupiah Up to Rp12,194 on Wednesday Morning"
2014-10-17,The Jakarta Post,JKPOST,Increased use of coal for power generation cuts oil imports
2014-10-17,The Jakarta Post,JKPOST,Bright future ahead for Indonesia's property sector
2014-10-17,LKBN ANTARA,ANTARA,"ECONOMIC NEWS
JAKARTA INDEX CLOSES HIGHER, RUPIAH GAIN"
2014-10-17,LKBN ANTARA,ANTARA,"ECONOMIC NEWS
NEWS FEATURE - CPO EXPECTED TO SUPPORT GOVT BIOFUEL PROGRAM"
2014-10-22,The Jakarta Post,JKPOST,Indonesia key investment hub for Japan
2014-10-24,The Jakarta Post,JKPOST,"Indonesia's exports at risk due to Chinese growth slowdown
Satria Sambijantoro, The Jakarta Post, Jakarta"
2014-10-24,LKBN ANTARA,ANTARA,"ECONOMIC NEWS
VICE PRESIDENT  UNCERTAIN  WHEN FUEL PRICE HIKE WILL OCCUR"
2014-10-24,Tempo.co,TEMPOE,"Politics at Ease, Rupiah Relies on Fundamentals"
2014-10-25,LKBN ANTARA,ANTARA,"ECONOMIC NEWS
 ECONOMY  REMAINS STAGNANT BEFORE CABINET ANNOUNCEMENT: OBSERVER"
2014-10-27,The Jakarta Post,JKPOST,"Jokowi pins reform hopes on  economic  team
Putera Satria Sambijantoro and Linda Yulisman , The Jakarta Post, Jakarta"
2014-10-27,Tempo.co,TEMPOE,"Rupiah Dips to Rp12,097 per US Dollar on Monday Evening"
2014-10-28,Tempo.co,TEMPOE,Cabinet Squeeze
2014-10-29,Tempo.co,TEMPOE,"Rupiah Trades at Rp12,155 per US Dollar"
2014-10-29,The Jakarta Post,JKPOST,"Govt hints at big hike in fuel price
Satria Sambijantoro  , The Jakarta Post, Jakarta"
2014-10-29,The Jakarta Post,JKPOST,Doubts linger about  economic  team
2014-10-29,LKBN ANTARA,ANTARA,"ECONOMIC NEWS
NEWS FOCUS - GOVT TO EXPLAIN ITS FUEL  POLICY  SOON"
2014-10-30,Tempo.co,TEMPOE,IDX Raises Listing Target
2014-10-31,The Jakarta Post,JKPOST,"Commentary: Cutting red tape will reduce business risks, bolster investment
Vincent Lingga  The Jakarta Post  Jakarta, The Jakarta Post, Jakarta"
2014-10-31,Tempo.co,TEMPOE,"Rupiah Slides to Rp12,115 per US Dollar on Friday Morning"
2014-11-01,The Jakarta Post,JKPOST,Public  reserving judgment on Cabinet: LSI
2014-11-01,The Jakarta Post,JKPOST,"Car makers brace for bumpy ride next year
Linda Yulisman, The Jakarta Post,"
2014-11-03,The Jakarta Post,JKPOST,"Discourse: Finance chief outlines ways to shift  subsidies , boost  tax , infrastructure"
2014-11-03,Tempo.co,TEMPOE,Rupiah Might Dip on Trade  Deficit : Analyst
2014-11-04,The Jakarta Post,JKPOST,Comments on other issues: Govt hints at big hike in fuel prices
2014-11-05,The Jakarta Post,JKPOST,Editorial: Stop the  fiscal  hemorrhage now
2014-11-07,Tempo.co,TEMPOE,"IDX Opens at 5,033.36 on Friday Morning"
2014-11-08,The Jakarta Post,JKPOST,"Govt aims to boost infrastructure projects,  tax  revenue next year
Tassia Sipahutar, The Jakarta Post, Jakarta"
2014-11-10,The Jakarta Post,JKPOST,"Unclear projects to be aborted
Tassia Sipahutar, The Jakarta Post, Jakarta"
2014-11-11,Tempo.co,TEMPOE,JCI Up by 5.73 Points on Tuesday Morning
2014-11-14,LKBN ANTARA,ANTARA,"ECONOMIC NEWS
CURRENT ACCOUNT  DEFICIT  TO IMPROVE IN Q4: ECONOMISTS"
2014-11-15,The Jakarta Post,JKPOST,"Meeting workers' basic needs could stop conflicts over wages: Minister
Hasyim Widhiarto, The Jakarta Post,"
2014-11-17,LKBN ANTARA,ANTARA,"ECONOMIC NEWS
COMMON COMMITMENT, STABILITY NEEDED TO REFORM ENERGY SECTOR: RESEARCHER"
2014-11-17,LKBN ANTARA,ANTARA,"|  
ECONOMIC NEWS
GOVERNMENT ADVISED TO HIKE SUBSIDIZED FUEL PRICES EARLY NEXT YEAR"
2014-11-18,LKBN ANTARA,ANTARA,"ECONOMIC NEWS
DEMOCRATS: NOT THE RIGHT TIME TO RAISE SUBSIDIZED BBM PRICES"
2014-11-19,The Jakarta Post,JKPOST,Analysis: Toward a better current account balance
2014-11-21,LKBN ANTARA,ANTARA,"ECONOMIC NEWS
STRUCTURAL REFORMATION IN REAL SECTOR CAN REDUCE DEPENDENCE ON EXPORTS"
2014-11-22,LKBN ANTARA,ANTARA,"ECONOMIC NEWS
HEDGING CAN BOOST SEVEN PERCENT  ECONOMIC  GROWTH"
