Date,Publisher,Publisher Code,Headline
2019-12-03,The Jakarta Post,JKPOST,High valuation vs profit: Chicken-egg issue for unicorns
2019-12-04,The Jakarta Post,JKPOST,"Synergy, transformation, innovation (Part 1 of 2)
Perry Warjiyo, The Jakarta Post, Jakarta"
2019-12-05,The Jakarta Post,JKPOST,"BI encourages private sector to fund infrastructure
Eisya A. Eloksari, The Jakarta Post, Jakarta"
2019-12-05,The Jakarta Post,JKPOST,"Germany complains RI nickel export ban will ruin steel industry
Dian Septiari, The Jakarta Post, Jakarta"
2019-12-07,LKBN ANTARA,ANTARA,"BUSSINESS
INDONESIA'S  ECONOMY  TO GROW 5.2% NEXT YEAR: ECONOMIST"
2019-12-09,The Jakarta Post,JKPOST,Quo vadis BI's  policy  communication?
2019-12-09,LKBN ANTARA,ANTARA,"BUSSINESS
INDONESIA'S  ECONOMY  STILL HEAVY IN 2020: DEPUTY MINISTER"
2019-12-10,Tempo Magazine,TEMGEN,Hope amid the Drought
2019-12-10,Tempo Magazine,TEMGEN,Hope amid the Drought
2019-12-11,The Jakarta Post,JKPOST,"RI's GDP growth to remain sluggish next year: Analysts
Adrian Wail Akhlas and Marchio Irfan Gorbiano, The Jakarta Post, Jakarta"
2019-12-13,The Jakarta Post,JKPOST,Harmonizing minimum wage system
2019-12-13,The Jakarta Post,JKPOST,"Employers keep growth expectations low
Eisya A. Eloksari, The Jakarta Post, Jakarta"
2019-12-14,The Jakarta Post,JKPOST,Data-driven strategy future of marketing: Agency
2019-12-16,The Jakarta Post,JKPOST,Trapped in 5% growth
2019-12-16,LKBN ANTARA,ANTARA,"BUSSINESS
GLOBAL  ECONOMIC  RISKS CAST SHADOW OVER MEDIUM-TERM DEVELOPMENT PLAN"
2019-12-17,The Jakarta Post,JKPOST,"Quo vadis, global ocean governance?"
2019-12-17,The Jakarta Post,JKPOST,"Cooling investments slow GDP growth in 2019
Riska Rahman, The Jakarta Post, Jakarta"
2019-12-17,Tempo Magazine,TEMGEN,The  Subsidy  Dilemma
2019-12-17,Tempo Magazine,TEMGEN,The  Subsidy  Dilemma
2019-12-18,The Jakarta Post,JKPOST,"2020: Maneuvering through challenging business,  economic  climate"
2019-12-18,The Jakarta Post,JKPOST,Economic  Outlook 2020: Business earnings to recover from double dip
2019-12-19,The Jakarta Post,JKPOST,"Digital  economy  reaches new highs in 2019
Adrian Wail Akhlas, The Jakarta Post, Jakarta"
2019-12-19,The Jakarta Post,JKPOST,"RI must move beyond GDP to assess welfare: Economists
Adrian Wail Akhlas, The Jakarta Post, Jakarta"
2019-12-19,LKBN ANTARA,ANTARA,"BUSSINESS
INDONESIA'S  ECONOMY  ESTIMATED TO GROW FIVE PERCENT IN 2019: ECONOMIST"
2019-12-19,LKBN ANTARA,ANTARA,"BUSSINESS
TRUMP'S IMPEACHMENT AND RIPPLE MAY EFFECT ON INDONESIA'S  ECONOMY"
2019-12-23,The Jakarta Post,JKPOST,"Workers wrestle with Labor Law, skills gap, automation
Made Anthony Iswara, The Jakarta Post, Bali"
2019-12-23,The Jakarta Post,JKPOST,"Indonesia doubles down on  economic  diplomacy
Apriza Pinandita and Tama Salim, The Jakarta Post, Jakarta"
2019-12-23,The Jakarta Post,JKPOST,Multi Bintang highlights sustainability as key in doing business
2019-12-23,The Jakarta Post,JKPOST,2020  Economic  Outlook: Corruption continues to hinder investment
2019-12-23,LKBN ANTARA,ANTARA,"BUSSINESS
GOVERNMENT LAUNCHING TWO SPECIAL  ECONOMIC  ZONES IN BATAM IN 2020"
2019-12-24,Tempo.co,TEMPOE,Boeing Fires CEO Muilenburg to Restore Confidence amid 737 Crisis
2019-12-26,The Jakarta Post,JKPOST,"Indonesia still struggles to reduce trade  deficit 
Made Anthony Iswara, The Jakarta Post, Denpasar, Bali"
2019-12-26,The Jakarta Post,JKPOST,"BI upbeat about loan growth despite sluggish  economy 
Adrian Wail Akhlas, The Jakarta Post, Jakarta"
2019-12-30,The Jakarta Post,JKPOST,"Mergers, acquisitions in banking industry mark 2019 despite weak loan growth
Riska Rahman, The Jakarta Post, Jakarta"
2019-12-30,The Jakarta Post,JKPOST,"Elections, trade war hamper property sector
Riska Rahman, The Jakarta Post, Jakarta"
2019-12-31,The Jakarta Post,JKPOST,"After hectic year, calm 2020 expected
Vela Andapita and Marchio Irfan Gorbiano, The Jakarta Post, Jakarta"
2019-12-31,The Jakarta Post,JKPOST,Questioning whether GDP still adequate to measure welfare
2020-01-02,The Jakarta Post,JKPOST,"Political stability, reforms to bring improvements to stock market
Riska Rahman, The Jakarta Post, Jakarta"
2020-01-02,The Jakarta Post,JKPOST,"Global  uncertainties , red tape to impede foreign investment plans
Norman Harsono, The Jakarta Post, Jakarta"
2020-01-03,The Jakarta Post,JKPOST,Construing '4+1 priorities' of RI diplomacy
2020-01-04,The Jakarta Post,JKPOST,"Fewer companies will hire new employees this year as automation grows: Survey
Made Anthony Iswara, The Jakarta Post, Denpasar, Bali"
2020-01-07,The Jakarta Post,JKPOST,What's wrong with oil and gas exploration in Indonesia?
2020-01-07,The Jakarta Post,JKPOST,"Farmers, experts call for oil palm  policy  change
Ghina Ghaliya, The Jakarta Post, Central Kalimantan"
2020-01-08,The Jakarta Post,JKPOST,Is Indonesia managing foreign debt prudently?
2020-01-08,The Jakarta Post,JKPOST,"Industries cheer plans to lower gas price amid  economic  gloom
Eisya A. Eloksari and Norman Harsono, The Jakarta Post, Jakarta"
2020-01-08,LKBN ANTARA,ANTARA,"BUSSINESS
GOVERNMENT MUST PREPARE TO ANTICIPATE US-IRAN TENSIONS"
2020-01-08,LKBN ANTARA,ANTARA,"BUSSINESS
PEOPLE'S PURCHASING POWER MUST BE MAINTAINED AMID US-IRAN CONFLICT"
2020-01-10,The Jakarta Post,JKPOST,"Better  tax  collection needed as 2020  tax  revenue target 'hard to achieve'
Adrian Wail Akhlas, The Jakarta Post, Jakarta"
2020-01-13,The Jakarta Post,JKPOST,"'Indonesia's energy industry underperforms in 2019'
Norman Harsono, The Jakarta Post, Jakarta"
2020-01-13,The Jakarta Post,JKPOST,Dealing with  fiscal  risk amid weak  tax  revenue growth
2020-01-13,Tempo Magazine,TEMGEN,A Good Start amidst the Middle East Escalating Tension
2020-01-13,Tempo Magazine,TEMGEN,A Good Start amidst the Middle East Escalating Tension
2020-01-14,The Jakarta Post,JKPOST,"Ministry suggests DMO to lower gas prices
Norman Harsono, The Jakarta Post, Jakarta"
2020-01-15,The Jakarta Post,JKPOST,"BI shrugs off geopolitical risks, citing strong capital inflows"
2020-01-15,The Jakarta Post,JKPOST,"RI's  economy  to slightly recover in 2020
Marchio Irfan Gorbiano, The Jakarta Post, Jakarta"
2020-01-16,The Jakarta Post,JKPOST,"Southeast Asians worried by superpower rivalry: Survey
Dian Septiari, The Jakarta Post, Jakarta"
2020-01-17,The Jakarta Post,JKPOST,"Deficit  likely to linger in 2020 as trade frictions continue
Made Anthony Iswara, The Jakarta Post, Denpasar, Bali"
2020-01-20,The Jakarta Post,JKPOST,"Bridgestone, Hankook to expand RI's sales networks
Made Anthony Iswara, The Jakarta Post, Jakarta"
2020-01-21,LKBN ANTARA,ANTARA,"BUSSINESS
GOVERNMENT OPTIMISTIC INDONESIA'S  ECONOMY  WILL REMAIN STRONG"
2020-01-21,Tempo Magazine,TEMGEN,Transparency of the Omnibus Laws
2020-01-21,Tempo Magazine,TEMGEN,Transparency of the Omnibus Laws
2020-01-22,The Jakarta Post,JKPOST,"Record-low poverty reduction rate calls for more robust policies
Made Anthony Iswara, The Jakarta Post, Jakarta"
2020-01-23,LKBN ANTARA,ANTARA,"|  
BUSSINESS
BI'S  POLICY  REMAINS ACCOMMODATIVE TO BOOST  ECONOMIC  GROWTH: GOVERNOR"
2020-01-24,Tempo.co,TEMPOE,Transparency of the Omnibus Laws
2020-01-27,The Jakarta Post,JKPOST,"BI to further cut rate to revive sluggish  economy 
Adrian Wail Akhlas and Made Anthony Iswara, The Jakarta Post, Jakarta"
2020-01-27,LKBN ANTARA,ANTARA,"BUSSINESS
NATIONAL  ECONOMIC  GROWTH MOMENTUM REMAINS STRONG"
2020-01-28,The Jakarta Post,JKPOST,"Falling loan demand hits state-owned banks' profit
Riska Rahman, The Jakarta Post, Jakarta"
2020-01-29,The Jakarta Post,JKPOST,"Coronavirus to affect stock market until contained: Analysts
Adrian Wail Akhlas and Made Anthony Iswara, The Jakarta Post, Jakarta"
2020-01-30,Tempo.co,TEMPOE,Sandiaga Uno Optimistic of Indonesia's  Economic  Growth
2020-01-30,The Jakarta Post,JKPOST,Mounting downside risks
2020-02-01,The Jakarta Post,JKPOST,"BPJS premiums, excise hikes to hit purchasing power
Riska Rahman, The Jakarta Post, Jakarta"
2020-02-01,LKBN ANTARA,ANTARA,"BUSSINESS
JCR AGENCY CREDITS INDONESIA WITH BBB+ RATING"
2020-02-03,The Jakarta Post,JKPOST,'Green' energy bill set to remove  uncertainty
2020-02-03,LKBN ANTARA,ANTARA,"BUSSINESS
JAPAN CREDIT RATING AGENCY RAISES INDONESIA'S RANKING TO BBB+"
2020-02-05,The Jakarta Post,JKPOST,Analysis: Boosting FDI amid challenging  economic  climate
2020-02-06,The Jakarta Post,JKPOST,Viral  economy  downside
2020-02-06,Tempo.co,TEMPOE,Sri Mulyani: Global  Uncertainty  Owing to Lack of Women Role
2020-02-06,Tempo.co,TEMPOE,Sri Mulyani: Women Representation in Global  Policy  Still Lacking
2020-02-08,The Jakarta Post,JKPOST,"Bank Muamalat seeks to fix performance
Eisya A. Eloksari, The Jakarta Post, Jakarta"
2020-02-08,The Jakarta Post,JKPOST,"RI's foreign exchange  reserves  close to all-time high in January
Adrian Wail Akhlas, The Jakarta Post, Jakarta"
2020-02-10,The Jakarta Post,JKPOST,"Local companies turn to global bonds to reduce funding costs
Riska Rahman, The Jakarta Post, Jakarta"
2020-02-10,LKBN ANTARA,ANTARA,"BUSSINESS
INDONESIA'S BOP FOR Q4 2019 RECORDED US$-4.3 BILLION SURPLUS: BI"
2020-02-11,LKBN ANTARA,ANTARA,"BUSSINESS
JOKOWI URGES MINISTRIES TO ACCELERATE  BUDGET  REALIZATION"
2020-02-11,Tempo.co,TEMPOE,Jokowi Instructs Ministries to Disburse  Budget  before Next Month
2020-02-12,The Jakarta Post,JKPOST,Analysis: Structural transformation in RI's  economic  growth blueprint
2020-02-12,The Jakarta Post,JKPOST,"Indonesia's 2020  budget deficit  may widen to 2.8% after  tax  shortfall: Indef
Adrian Wail Akhlas, The Jakarta Post, Jakarta"
2020-02-13,The Jakarta Post,JKPOST,"Omnibus bills submitted,  public  remains in dark
Adrian Wail Akhlas and Ghina Ghaliya, The Jakarta Post, Jakarta"
2020-02-13,The Jakarta Post,JKPOST,The cost of  uncertainty
2020-02-13,The Jakarta Post,JKPOST,"Omnibus bill to overhaul regional  taxation 
Adrian Wail Akhlas, The Jakarta Post, Jakarta"
2020-02-13,The Jakarta Post,JKPOST,"Govt to front-load social, rural development  spending 
Riska Rahman, The Jakarta Post, Jakarta"
2020-02-14,The Jakarta Post,JKPOST,"Omnibus job bill divides unions, faces criticism
Ghina Ghaliya and Adrian Wail Akhlas, The Jakarta Post, Jakarta"
2020-02-14,The Jakarta Post,JKPOST,"Key points of labor reform in omnibus bill on job creation
Esther Samboh, The Jakarta Post, Jakarta"
2020-02-17,The Jakarta Post,JKPOST,Indonesian GDP growth and service industry development
2020-02-17,LKBN ANTARA,ANTARA,"BUSSINESS
INDONESIA'S EXTERNAL DEBT AT 2019-END RECORDED AT US$404.3 BILLION"
2020-02-18,The Jakarta Post,JKPOST,"Indonesia may get new business license regime with omnibus bill
Adrian Wail Akhlas, The Jakarta Post, Jakarta"
2020-02-20,The Jakarta Post,JKPOST,"Jokowi gearing up to meet Trump in US next month
Apriza Pinandita, The Jakarta Post, Jakarta"
2020-02-20,LKBN ANTARA,ANTARA,"BUSSINESS
COVID-19 HAMPERS GLOBAL  ECONOMIC  RECOVERY: BI"
2020-02-20,Tempo.co,TEMPOE,Sri Mulyani Sets Up  Stimulus  Package to Offset Coronavirus Impact
2020-02-24,LKBN ANTARA,ANTARA,"BUSSINESS
BI STRESSES GREATER COOPERATION TO RESTORE GLOBAL CONDITIONS"
2020-02-24,Tempo Magazine,TEMGEN,Need for Speed
2020-02-24,Tempo.co,TEMPOE,G20 Members Increase Partnership Amid Coronavirus Outbreak
2020-02-24,Tempo Magazine,TEMGEN,Need for Speed
2020-02-26,Tempo.co,TEMPOE,Need for Speed
2020-02-26,LKBN ANTARA,ANTARA,"BUSSINESS
2020 STATE  BUDGET DEFICIT  CAN POTENTIALLY WIDEN AMID GLOBAL  UNCERTAINTY"
2020-02-27,The Jakarta Post,JKPOST,How COVID-19 impacts monetary  policy
2020-02-28,The Jakarta Post,JKPOST,"Stocks near 3-year low as foreign investors post huge sell-off
Riska Rahman, The Jakarta Post, Jakarta"
2020-02-29,The Jakarta Post,JKPOST,"Astra International profits hit by fewer car sales, lower commodity prices
Prima Wirayani and Eisya A. Eloksari, The Jakarta Post, Jakarta"
2020-03-02,The Jakarta Post,JKPOST,Banning or wooing travelers in time of novel coronavirus
2020-03-02,The Jakarta Post,JKPOST,"Market braces for volatile March after $2.4b vanishes in a week
Adrian Wail Akhlas and Esther Samboh, The Jakarta Post, Jakarta"
2020-03-02,LKBN ANTARA,ANTARA,"BUSSINESS
BI STRENGTHENS MEASURES TO STABILISE RUPIAH"
2020-03-07,The Jakarta Post,JKPOST,"Indonesia's forex  reserves  drop from record high
Adrian Wail Akhlas, The Jakarta Post, Jakarta"
2020-03-09,The Jakarta Post,JKPOST,RI's car sales to bounce back in March: Gaikindo
2020-03-09,The Jakarta Post,JKPOST,Executive Column: More than a woman in business: Shinta talks leadership in  economy
2020-03-09,Tempo.co,TEMPOE,Jokowi Urges Ministers to Study Coronavirus' Impact on  Economy
2020-03-09,LKBN ANTARA,ANTARA,"BUSSINESS
MINISTER FORECASTS  BUDGET DEFICIT  TO REACH 2.2-2.5 PERCENT OF GDP"
2020-03-10,The Jakarta Post,JKPOST,"Government to make most of low global oil prices
Norman Harsono, The Jakarta Post, Jakarta"
2020-03-10,Tempo Magazine,TEMGEN,"Perry Warjiyo, Governor,  Bank Indonesia : Global Investors Are Still Waiting"
2020-03-10,Tempo Magazine,TEMGEN,"Perry Warjiyo, Governor,  Bank Indonesia : Global Investors Are Still Waiting"
2020-03-11,The Jakarta Post,JKPOST,Analysis: Banking industry: Anticipating impact of global  uncertainties
2020-03-11,The Jakarta Post,JKPOST,"Budget deficit  may pass 3% ceiling
Marchio Irfan Gorbiano and Adrian Wail Akhlas, The Jakarta Post, Jakarta"
2020-03-14,The Jakarta Post,JKPOST,Kalla as Mideast peace envoy: Opportunity for Nobel recognition?
2020-03-17,Tempo Magazine,TEMGEN,Complacently Risking  Budget s Credibility
2020-03-17,Tempo Magazine,TEMGEN,Complacently Risking  Budget s Credibility
2020-03-19,The Jakarta Post,JKPOST,Auto association downplays impact of COVID-19
2020-03-19,LKBN ANTARA,ANTARA,"BUSSINESS
BI LOWERS  ECONOMIC  GROWTH PROJECTION FOR 2020 TO 4.2-4.6 PERCENT"
2020-03-20,The Jakarta Post,JKPOST,Commentary: Economics of partial lockdown to contain spread of coronavirus
2020-03-20,The Jakarta Post,JKPOST,"BI cuts rate, growth may dip to 15-year low on COVID-19
Adrian Wail Akhlas, The Jakarta Post, Jakarta"
2020-03-23,The Jakarta Post,JKPOST,"Jokowi calls for focus on health care, safety net as economists push for flexible  budget 
Adrian Wail Akhlas, The Jakarta Post, Jakarta"
2020-03-23,The Jakarta Post,JKPOST,COVID-19  stimulus : Learning from others
2020-03-24,Tempo Magazine,TEMGEN,A Soft Yet Lethal Blow
2020-03-24,Tempo Magazine,TEMGEN,A Soft Yet Lethal Blow
2020-03-26,The Jakarta Post,JKPOST,Cooperation: The catalyst for fighting the COVID-19 crisis
2020-03-26,The Jakarta Post,JKPOST,"Minister asks SOEs to issue bonds to help rupiah
Riska Rahman, The Jakarta Post, Jakarta"
2020-03-27,LKBN ANTARA,ANTARA,"BUSSINESS
INDONESIA'S NET INTERNATIONAL INVESTMENT LIABILITY POSITION WIDENS"
2020-03-31,The Jakarta Post,JKPOST,"RI palm oil exports to China drop by half in January: GAPKI
Made Anthony Iswara, The Jakarta Post, Jakarta"
2020-03-31,The Jakarta Post,JKPOST,Don't let COVID-19 become a hunger game
2020-03-31,LKBN ANTARA,ANTARA,"FEATURES
 ECONOMIC STIMULUS , SOCIAL SAFETY GET PRIORITY AS SLOWDOWN LOOMS"
2020-04-01,The Jakarta Post,JKPOST,"Coal demand slumps as major buyers impose lockdowns
Norman Harsono, The Jakarta Post, Jakarta"
2020-04-02,The Jakarta Post,JKPOST,Bold response to COVID-19
2020-04-03,LKBN ANTARA,ANTARA,"BUSSINESS
ADB PROJECTS  ECONOMIC  SLOWDOWN IN INDONESIA IN 2020 OVER COVID-19"
2020-04-04,The Jakarta Post,JKPOST,"Inflation stable in March but COVID-19 risks loom: Economists
Mardika Parama, The Jakarta Post, Jakarta"
2020-04-06,The Jakarta Post,JKPOST,"Jakarta's poor at risk as city drags feet on COVID-19 social assistance
Sausan Atika, The Jakarta Post, Jakarta"
2020-04-07,The Jakarta Post,JKPOST,Analysis: Imperatives for financial institutions during  uncertainty
2020-04-08,The Jakarta Post,JKPOST,Analysis:  Economic  prospects amid COVID-19 pandemic
2020-04-08,LKBN ANTARA,ANTARA,"BUSSINESS
APEC MEMBERS OFFER  FISCAL  SUPPORT TO SMES AMID COVID-19 PANDEMIC"
2020-04-09,The Jakarta Post,JKPOST,"House shelves mining law revision, activists skeptical
A. Muh. Ibnu Aqil, The Jakarta Post, Jakarta"
2020-04-09,The Jakarta Post,JKPOST,"COVID-19 drives down loan growth to record low
Made Anthony Iswara and Riska Rahman, The Jakarta Post, Jakarta"
2020-04-13,The Jakarta Post,JKPOST,"61 firms ready to buy back shares to prop up prices
Yunindita Prasidya, The Jakarta Post, Jakarta"
2020-04-14,The Jakarta Post,JKPOST,"BI expects forex  reserves  to increase to $125 billion
Adrian Wail Akhlas, The Jakarta Post, Jakarta"
2020-04-14,Tempo Magazine,TEMGEN,Unemployment Crisis
2020-04-14,Tempo Magazine,TEMGEN,Champion of Borrowing Frenzy
2020-04-14,Tempo Magazine,TEMGEN,The Wave of Unemployment
2020-04-16,The Jakarta Post,JKPOST,New challenges for preemployment program
2020-04-17,The Jakarta Post,JKPOST,"Pandemic leaves first-time jobseekers in limbo
Ardila Syakriah, The Jakarta Post, Jakarta"
2020-04-17,The Jakarta Post,JKPOST,"Two newcomers soar on RI bourse despite market see-saw
Yunindita Prasidya, The Jakarta Post, Jakarta"
2020-04-18,The Jakarta Post,JKPOST,"Trade data paints gloomy picture of manufacturing industries
Adrian Wail Akhlas, The Jakarta Post, Jakarta"
2020-04-20,LKBN ANTARA,ANTARA,"NATIONAL NEWS
MEDIA AND POLITICIANS' LUST: FUEL OF OUTRAGES ON PANDEMIC STAGE"
2020-04-21,The Jakarta Post,JKPOST,"BI tells banks to buy govt bonds using $6.5b in excess liquidity
Adrian Wail Akhlas, The Jakarta Post, Jakarta"
2020-04-21,The Jakarta Post,JKPOST,"Pandemic forces Indonesian mothers to do it all
Ardila Syakriah, The Jakarta Post, Jakarta"
2020-04-21,The Jakarta Post,JKPOST,"New landscape demands businesses adapt or die
Farida Susanty, The Jakarta Post, Jakarta"
2020-04-21,Tempo Magazine,TEMGEN,Food Crisis
2020-04-21,LKBN ANTARA,ANTARA,"BUSSINESS
APEC FACES OUTPUT LOSS OF US$2.1 TRILLION OWING TO COVID-19"
2020-04-25,Tempo.co,TEMPOE,"|  
Food Crisis"
2020-04-28,The Jakarta Post,JKPOST,We can see the light
2020-04-28,The Jakarta Post,JKPOST,"Recession looms amid virus response  uncertainty 
Adrian Wail Akhlas, The Jakarta Post, Jakarta"
2020-04-28,Tempo Magazine,TEMGEN,Governor of Central Java Ganjar Pranowo: Returnees Will Be Sent Back
2020-04-29,The Jakarta Post,JKPOST,"IDX lowers expectations, relies on domestic investors
Riska Rahman, The Jakarta Post, Jakarta"
2020-04-29,LKBN ANTARA,ANTARA,"NATIONAL NEWS
PRESIDENTIAL STAFF OFFICE LAUNCHES ""SEJIWA"" PSYCHOLOGICAL AID SERVICE FOR COMMUNITY"
2020-05-01,Tempo.co,TEMPOE,No Hasty Cuts
2020-05-02,The Jakarta Post,JKPOST,"Alone and sexually frustrated amid pandemic
Ramadani Saputra, The Jakarta Post,"
2020-05-02,The Jakarta Post,JKPOST,"Garment workers seek govt, corporate responsibility"
2020-05-02,LKBN ANTARA,ANTARA,"FEATURES
GAUGING WHETHER PRE-EMPLOYMENT CARD IS A SOLUTION AMID COVID-19 PANDEMIC"
2020-05-05,The Jakarta Post,JKPOST,Insight: COVID-19 opportunity to enhance our environmental commitments
2020-05-05,Tempo Magazine,TEMGEN,"Pondering at THE V, U or L Trajectory"
2020-05-05,The Jakarta Post,JKPOST,"Indonesia records 'unusually' low inflation in Ramadan as COVID-19 hits consumer  spending 
Adrian Wail Akhlas , The Jakarta Post, Jakarta"
2020-05-06,The Jakarta Post,JKPOST,Analysis: COVID-19 impact on construction sector
2020-05-06,The Jakarta Post,JKPOST,"Worst may be yet to come as growth hits 19-year low
Adrian Wail Akhlas, The Jakarta Post, Jakarta"
2020-05-06,The Jakarta Post,JKPOST,"Indonesia's Q1  economic  growth the weakest since 2001, slows more than expected
Adrian Wail Akhlas, The Jakarta Post, Jakarta"
2020-05-06,The Jakarta Post,JKPOST,"Foreign companies go ahead with acquisition plans despite COVID-19 pandemic
Riska Rahman, The Jakarta Post, Jakarta"
2020-05-06,The Jakarta Post,JKPOST,"Indonesia's  economy  heads into turbulence as Q1 growth plunges: Economists
Adrian Wail Akhlas, The Jakarta Post, Jakarta"
2020-05-07,Tempo.co,TEMPOE,Property Prices Decreases in Second Quarter of 2020
2020-05-10,The Jakarta Post,JKPOST,"Halal food rising in popularity amid COVID-19 pandemic, reports indicate
Yunindita Prasidya, The Jakarta Post, Jakarta"
2020-05-10,The Jakarta Post,JKPOST,"COVID-19 behind decline in corporate bond issuances, analysts say
Riska Rahman, The Jakarta Post, Jakarta"
2020-05-11,The Jakarta Post,JKPOST,Against the odds of COVID-19
2020-05-12,Tempo Magazine,TEMGEN,A Back Alley to Avoid  Economy  Contraction
2020-05-12,Tempo.co,TEMPOE,Sri Mulyani Pegs 2021  Economic  Growth at 4.5 to 5.5%
2020-05-13,The Jakarta Post,JKPOST,"Lender OCBC NISP slashes loan growth target
Riska Rahman, The Jakarta Post, Jakarta"
2020-05-13,The Jakarta Post,JKPOST,"Indonesia's financial system at risk amid pandemic: KSSK
Adrian Wail Akhlas, The Jakarta Post, Jakarta"
2020-05-14,The Jakarta Post,JKPOST,Insight: McDonald's farewell gathering: The cost of COVID-19 'lies'
2020-05-14,The Jakarta Post,JKPOST,Coal barons win
2020-05-14,Tempo Magazine,TEMGEN,Celebrating Solidarity
2020-05-14,Tempo Magazine,TEMGEN,The Feds Gamble on Dollar Credibility
2020-05-16,The Jakarta Post,JKPOST,"Banking shares under pressure as investors avoid risk
Yunindita Prasidya, The Jakarta Post, Jakarta"
2020-05-16,LKBN ANTARA,ANTARA,"NATIONAL NEWS
INDONESIAN EMBASSY IN SLOVAKIA DISTRIBUTES RELIEF AID TO INDONESIANS"
2020-05-18,The Jakarta Post,JKPOST,Let's prevent burnout among already scarce physicians
2020-05-18,The Jakarta Post,JKPOST,"Budget  for  public  works, transportation slashed by Rp 54.8t
Mardika Parama, The Jakarta Post, Jakarta"
2020-05-18,The Jakarta Post,JKPOST,At whose cost?
2020-05-19,The Jakarta Post,JKPOST,"Investors turn to govt bonds to avoid risk
Yunindita Prasidya, The Jakarta Post, Jakarta"
2020-05-19,LKBN ANTARA,ANTARA,"BUSSINESS
BI KEEPS BENCHMARK RATE UNCHANGED AT 4.5%"
2020-05-20,The Jakarta Post,JKPOST,"US pharma may think twice about Indonesia: Experts
Mardika Parama, The Jakarta Post, Jakarta"
2020-05-20,LKBN ANTARA,ANTARA,"BUSSINESS
INDONESIA'S Q1 CURRENT ACCOUNT  DEFICIT  NARROWS TO US$3.9 BILLION"
2020-05-20,Tempo.co,TEMPOE,Celebrating Solidarity
2020-05-21,LKBN ANTARA,ANTARA,"INTERNATIONAL NEWS
RI-SPORE'S COOPERATION EXPECTED TO BOOST GLOBAL  ECONOMIC  STABILITY: VP"
2020-05-22,The Jakarta Post,JKPOST,Analysis: Maintaining stability during the pandemic
2020-05-28,The Jakarta Post,JKPOST,"Greater Jakarta in dark about 'new normal' commuting
Sausan Atika, The Jakarta Post, Jakarta"
2020-05-28,The Jakarta Post,JKPOST,"Residential property sales, prices fall amid virus
Dzulfiqar Fathur Rahman, The Jakarta Post, Jakarta"
2020-05-28,LKBN ANTARA,ANTARA,"BUSSINESS
TRADE,  ECONOMIC  SLUMP DEEPEN IN APEC REGION; OUTLOOK REMAINS BLEAK"
2020-05-30,The Jakarta Post,JKPOST,Trust key in diplomacy amid global  uncertainty
2020-05-30,The Jakarta Post,JKPOST,"RI auto industry remains attractive: Fitch Solutions
Dzulfiqar Fathur Rahman, The Jakarta Post, Jakarta"
2020-06-02,The Jakarta Post,JKPOST,ASEAN solidarity and response in the face of COVID-19
2020-06-02,Tempo Magazine,TEMGEN,Bad Timing
2020-06-02,The Jakarta Post,JKPOST,"Statements on 'new normal' confusing: Muhammadiyah
Sri Wahyuni, The Jakarta Post, Yogyakarta"
2020-06-03,The Jakarta Post,JKPOST,"Ultra-rich savers to boost bank liquidity
Yunindita Prasidya, The Jakarta Post, Jakarta"
2020-06-05,The Jakarta Post,JKPOST,How COVID-19 will reshape Islamic finance markets
2020-06-06,The Jakarta Post,JKPOST,"Consumers cut back  spending , boost savings
Riza Roidila Mufti, The Jakarta Post, Jakarta"
2020-06-06,LKBN ANTARA,ANTARA,"NATIONAL NEWS
WEST SUMATRA TO ENTER NEW NORMAL PHASE FROM JUNE 8"
2020-06-10,The Jakarta Post,JKPOST,"Indonesia's foreign exchange  reserves  soar to $130.5b in May
Adrian Wail Akhlas, The Jakarta Post, Jakarta"
2020-06-12,The Jakarta Post,JKPOST,Oil prices get big impetus from supply cuts
2020-06-13,The Jakarta Post,JKPOST,"Investors wary of Indofood CBP's acquisition of noodle-maker Pinehill
Yunindita Prasidya, The Jakarta Post, Jakarta"
2020-06-15,The Jakarta Post,JKPOST,"Trade data point to severe contraction in Q2
Adrian Wail Akhlas, The Jakarta Post, Jakarta"
2020-06-16,Tempo Magazine,TEMGEN,A New saving for Workers
2020-06-16,Tempo Magazine,TEMGEN,The Rising Threat of A Second Wave
2020-06-16,Tempo Magazine,TEMGEN,Draining Coffers for Biodiesel
2020-06-17,The Jakarta Post,JKPOST,"COVID-19 spurs shift to prioritizing basic needs
Sudibyo M. Wiradji, The Jakarta Post, Jakarta"
2020-06-17,The Jakarta Post,JKPOST,Can ASEAN achieve integration by 2025?
2020-06-18,The Jakarta Post,JKPOST,Analysis: Banking industry update: The most challenging year since 1998
2020-06-18,The Jakarta Post,JKPOST,"RI pins hope on ASEAN role as virus affects Indo-Pacific dynamics
Dian Septiari, The Jakarta Post, Jakarta"
2020-06-20,Tempo.co,TEMPOE,"Pandemic, ADB Forecasts Indonesia's  Economy  to Recover in 2021"
2020-06-22,The Jakarta Post,JKPOST,"Uncertainties  loom over RI's  economic  growth
Adrian Wail Akhlas, The Jakarta Post, Jakarta"
2020-06-23,Tempo Magazine,TEMGEN,Bosowa-Kallas Last chance
2020-06-24,Tempo.co,TEMPOE,"Jakarta Formula E May be Held in 2023, Says Jakpro"
2020-06-25,The Jakarta Post,JKPOST,"Ministry encourages innovation to curb raw material imports
Dzulfiqar Fathur Rahman, The Jakarta Post, Jakarta"
2020-06-25,Tempo.co,TEMPOE,IMF Projects Indonesia's 2020  Economic  Growth at -0.3%
2020-06-25,LKBN ANTARA,ANTARA,"BUSSINESS
GOVERNMENT SHOULD PREEMPTIVELY TACKLE CLIMATE CHANGE IMPACTS ON RICE YIELD"
2020-06-26,The Jakarta Post,JKPOST,"ASEAN, migrant workers and the COVID-19 crisis"
2020-06-26,The Jakarta Post,JKPOST,Bailing out 60 million firms
2020-06-26,The Jakarta Post,JKPOST,"'Crisis like no other' to hit RI  economy , warns IMF
Adrian Wail Akhlas, The Jakarta Post, Jakarta"
2020-06-27,The Jakarta Post,JKPOST,"Consumer firms defy crisis
Riska Rahman, The Jakarta Post, Jakarta"
2020-06-27,The Jakarta Post,JKPOST,"RI looks to sign RCEP this year to support  economic  recovery
Dzulfiqar Fathur Rahman, The Jakarta Post, Jakarta"
2020-06-29,The Jakarta Post,JKPOST,'Pasrah' as a discourse in new normal
