Date,Publisher,Publisher Code,Headline
2004-08-19,The Jakarta Post,JKPOST,"Fifty  economic  bills await new government   
Zakki P. Hakim and Rendi A. Witular, The Jakarta Post/Jakarta"
2004-08-20,The Jakarta Post,JKPOST,"50% of industrial zones closed   
Rendi A. Witular, Jakarta"
2004-08-23,The Jakarta Post,JKPOST,"Govt to get tough on taxpayers to offset losses   
Rendi A. Witular , Jakarta"
2004-08-26,The Jakarta Post,JKPOST,"IFC to up investment on positive RI outlook   
Rendi A. Witular , Jakarta"
2004-08-31,The Jakarta Post,JKPOST,"Boediono sees rising investment next year   
Dadan Wijaksana , The Jakarta Post/Jakarta"
2004-09-06,The Jakarta Post,JKPOST,NISP sees lively business in manufacturing sector next year
2004-09-07,The Jakarta Post,JKPOST,"WTO deals -- will they really help expand Indonesian farm exports?   
Kiki Verico , Jakarta"
2004-09-09,The Jakarta Post,JKPOST,"Righting reform, the gap between rules and  public  perception   
Dani Rodrik , Project Syndicate"
2004-09-10,The Jakarta Post,JKPOST,"Economy  to recover quickly from blast, says Dorodjatun   
Dadan Wijaksana , The Jakarta Post, Jakarta"
2004-09-11,Bisnis Indonesia,BISNIS,Market Responds Rationally to Kuningan Blast
2004-09-14,The Jakarta Post,JKPOST,No panic reaction
2004-09-14,The Jakarta Post,JKPOST,"Not everyone is a victim of RI's financial crisis   
Veeramalla Anjaiah, The Jakarta Post/Paris"
2004-09-15,The Jakarta Post,JKPOST,"House OKs law on  economic  planning   
Dadan Wijaksana, The Jakarta Post/Jakarta"
2004-09-16,Bisnis Indonesia,BISNIS,Banking Loans Stagnant; 'Corporate Sector not Keeping Up with Banks'
2004-09-16,The Jakarta Post,JKPOST,"Central Bank , Kadin at odds over low lending   
Dadan Wijaksana/Tony Hotland , The Jakarta Post/Jakarta"
2004-09-16,The Jakarta Post,JKPOST,"Low competitiveness seen as major obstacle to growth   
The Jakarta Post , Jakarta"
2004-09-16,The Jakarta Post,JKPOST,"BI projects higher growth of 6% by 2006   
Tony Hotland , The Jakarta Post/Jakarta"
2004-09-16,The Jakarta Post,JKPOST,"Jasa Marga told to delay key bond plan   
Rendi A. Witular , Jakarta"
2004-09-17,The Jakarta Post,JKPOST,Basic-needs approach
2004-09-17,The Jakarta Post,JKPOST,"Nationalist sentiment in business judgment   
Umar Juoro , Jakarta"
2004-09-17,The Jakarta Post,JKPOST,"Embassy bombing will affect FDI   
The Jakarta Post , Jakarta"
2004-09-18,The Jakarta Post,JKPOST,"Megawati, Susilo and people's choice  
Suko Sudarso , Jakarta"
2004-09-19,The Jakarta Post,JKPOST,"Scholar Julia takes on patriarchal powers  
Carla Bianpoen , Contributor/Jakarta"
2004-09-21,The Jakarta Post,JKPOST,"Smooth election boosts  economic  sentiment: Experts  
Dadan Wijaksana, The Jakarta Post/Jakarta"
2004-09-22,Bisnis Indonesia,BISNIS,Investment Performance to Improve;  Economy  to Grow by 5% in 2004
2004-09-23,The Jakarta Post,JKPOST,"Indonesia has fresh chance with democracy  
Greg Barton , Jakarta"
2004-09-24,The Jakarta Post,JKPOST,"BI sees no need for rate hike   
The Jakarta Post , Jakarta"
2004-09-27,The Jakarta Post,JKPOST,"SBY told to scrap high-cost  economy 
Ridwan Max Sijabat , The Jakarta Post, Jakarta"
2004-09-27,The Jakarta Post,JKPOST,"Central bank  sees higher lending after smooth election   
The Jakarta Post , Jakarta"
2004-09-29,The Jakarta Post,JKPOST,"Presidential transition and RI's foreign  policy 
Bantarto Bandoro , Jakarta"
2004-10-07,The Jakarta Post,JKPOST,"BI keeps rate stable at 7.40%   
The Jakarta Post , Jakarta"
2004-10-11,The Jakarta Post,JKPOST,"Susilo's  budget  revision plan hailed  
Rendi A. Witular , Jakarta"
2004-10-12,LKBN ANTARA,ANTARA,TUESDAY'S EDITORIALS IN MAJOR INDONESIAN DAILIES
2004-10-13,The Jakarta Post,JKPOST,"Indonesia at a critical moment  
Patrick Guntensperger, Jakarta"
2004-10-14,The Jakarta Post,JKPOST,"Democracy on a high, but tough choices loom   
Satish Mishra, Jakarta"
2004-10-21,Bisnis Indonesia,BISNIS,SBY to Run Open  Economic Policy
2004-10-25,The Jakarta Post,JKPOST,"Study shows Indonesia's business climate among the worst in world  
Dadan Wijaksana , The Jakarta Post, Jakarta"
2004-10-29,The Jakarta Post,JKPOST,"Indonesia needs effective PR, not propaganda  
Yuli Ismartono , Jakarta"
2004-10-29,The Jakarta Post,JKPOST,"WB urges government to empower small and medium-scale businesses  
Rendi A. Witular , The Jakarta Post, Jakarta"
2004-10-30,The Jakarta Post,JKPOST,"Bring down the barriers to business; World Bank   
Tony Hotland and Zakki P. Hakim , The Jakarta Post/Jakarta"
2004-11-04,The Jakarta Post,JKPOST,"Govt to speed up Bapepam merger   
Rendi A. Witular, The Jakarta Post/Jakarta"
2004-11-05,The Jakarta Post,JKPOST,"It's easier to make speeches, but implementation is the real test."
2004-11-08,The Jakarta Post,JKPOST,New hope in oil industry
2004-11-09,The Jakarta Post,JKPOST,"Govt 'must act now to up investment'   
Leony Aurora, The Jakarta Post, Jakarta"
2004-11-10,The Jakarta Post,JKPOST,"Economy  better, investment needs fixing   
Urip Hudiono , The Jakarta Post, Jakarta"
2004-11-10,Bisnis Indonesia,BISNIS,World Bank Improves Indonesian Prospect
2004-11-11,Bisnis Indonesia,BISNIS,"Foreign Investment Down, Domestic Investment Up"
2004-11-21,The Jakarta Post,JKPOST,"Making sense of RI's business climate   
Arya B. Gaduh , Contributor, Jakarta"
2004-11-22,The Jakarta Post,JKPOST,"Part 1 of 2: U.S. and Indonesia must work to build ties  
Ambassador Marie T. Huhtala , Washington DC"
2004-11-24,The Jakarta Post,JKPOST,"Free trade and the national interests  
Endy M. Bayuni, The Jakarta Post, Santiago"
2004-11-24,The Jakarta Post,JKPOST,"Part 2 of 2: The challenge of security for the world  economy 
Susilo Bambang Yudhoyono, Santiago"
2004-11-30,The Jakarta Post,JKPOST,The falling dollar and the rupiah
2004-11-30,The Jakarta Post,JKPOST,"BKPM seeks to complete new investment bill   
The Jakarta Post , Jakarta"
2004-12-01,The Jakarta Post,JKPOST,"Consumption not the spark behind  economic  growth   
Christopher Lingle, Bali"
2004-12-03,The Jakarta Post,JKPOST,"Legal  uncertainty  main snag: S&P   
Urip Hudiono, The Jakarta Post/Jakarta"
2004-12-15,The Jakarta Post,JKPOST,"Buyat Case: Has the pendulum really swung to the environment?   
Andri G. Wibisana, Maastricht, Netherlands"
2004-12-16,The Jakarta Post,JKPOST,"RI stuck at home with domestic crises: UIN  
Muhammad Nafik , The Jakarta Post, Jakarta"
2004-12-17,The Jakarta Post,JKPOST,"Global powers wrestling with the future   
Ralf Dahrendorf , Project Syndicate"
2004-12-23,The Jakarta Post,JKPOST,"S&P raises RI rating on bullish outlook   
The Jakarta Post , Jakarta"
2004-12-28,The Jakarta Post,JKPOST,"Modest growth continues amid signs of investment recovery   
The Jakarta Post, Jakarta"
2004-12-29,The Jakarta Post,JKPOST,"Indonesia-EU relations: Stage set for big leap in the year 2005   
Veeramalla Anjaiah, The Jakarta Post/Jakarta"
2004-12-30,The Jakarta Post,JKPOST,"General elections and triumph of pragmatism   
Chusnul Mar'iyah"
2004-12-31,The Jakarta Post,JKPOST,"RI's new govt: A diagnosis and a prognosis   
Kahlil Rowter"
2005-01-03,The Jakarta Post,JKPOST,"Court rulling raises  uncertainty  in energy sector   
Eddy Satriya , Jakarta"
2005-01-08,The Jakarta Post,JKPOST,"Laying groundwork for change in the  tax  office   
Rendi A. Witular , The Jakarta Post/Jakarta"
2005-01-17,The Jakarta Post,JKPOST,"Power, transportation are most important"
2005-01-18,LKBN ANTARA,ANTARA,"|  
EU PUTS LEGAL CERTAINTY IN INDONESIA UNDER ITS SPOTLIGHT"
2005-01-18,The Jakarta Post,JKPOST,"Govt rolls out red carpet for investors  
Fabiola Desy Unidjaja and Zakki P. Hakim , The Jakarta Post, Jakarta"
2005-01-18,The Jakarta Post,JKPOST,"New partnership for infrastructure in Indonesia   
Jemal-ud-din Kassum, Jakarta"
2005-01-19,The Jakarta Post,JKPOST,"Govt told to remedy legal  uncertainties 
Fabiola Desy Unidjaja and Rendi A. Witular, The Jakarta Post, Jakarta"
2005-01-24,The Jakarta Post,JKPOST,Ensuring aid effectiveness
2005-01-25,The Jakarta Post,JKPOST,"Government decides to adopt 'enclave' FTZ in Batam   
Zakki P. Hakim, The Jakarta Post/Jakarta"
2005-01-25,The Jakarta Post,JKPOST,"Public -private partnerships in basic infrastructure  
Eric Teo Chu Cheow, Singapore"
2005-01-26,The Jakarta Post,JKPOST,"Sustainable infrastructure development   
Giovanni Comparini , Jakarta"
2005-01-29,The Jakarta Post,JKPOST,"Reorganizations at state firms await new rules  
Rendi A. Witular , The Jakarta Post/Jakarta"
2005-02-04,The Jakarta Post,JKPOST,"Govt red tape retards infrastructure investment   
Rendi A. Witular , The Jakarta Post, Jakarta"
2005-02-05,The Jakarta Post,JKPOST,"BI urges govt to hike fuel prices immediately   
Rendi A. Witular , The Jakarta Post/Jakarta"
2005-02-06,The Jakarta Post,JKPOST,"Discriminatory rules still haunt Chinese-Indonesians  
Kurniawan Hari, The Jakarta Post, Jakarta"
2005-02-12,The Jakarta Post,JKPOST,"RI removed from money laundering list   
Rendi A. Witular , The Jakarta Post/Jakarta"
2005-02-15,The Jakarta Post,JKPOST,"Considering an alternative to the direct elections in Aceh  
C. Effendi , Jakarta"
2005-02-16,LKBN ANTARA,ANTARA,REI IS STILL FACING OBSTACLES IN BUILDING LOW-C0ST HOMES
2005-02-17,The Jakarta Post,JKPOST,"Economy  grew by 5.13% in 2004: BPS   
Urip Hudiono , The Jakarta Post, Jakarta"
2005-02-20,The Jakarta Post,JKPOST,"Power-ideology balance over 50 years   
Ehito Kimura, Contributor, Jakarta"
2005-02-22,The Jakarta Post,JKPOST,"Banking sector still risky: S&P   
Leony Aurora  , The Jakarta Post, Jakarta"
2005-02-24,The Jakarta Post,JKPOST,"Preparing  public  for higher fuel prices   
Vincent Lingga , Jakarta"
2005-02-26,LKBN ANTARA,ANTARA,DOMESTIC BANK  INTEREST RATES  EXPECTED TO DROP IN NEAR FUTURE
2005-03-01,The Jakarta Post,JKPOST,"Fuel prices hiked, sacrifices called   
The Jakarta Post , Jakarta"
2005-03-01,LKBN ANTARA,ANTARA,OIL PRICE HIKES TO PUSH UP INFLATION BY TWO PERCENT: OBSERVER
2005-03-03,The Jakarta Post,JKPOST,"The Great River default: Sign of deindustrialization?   
Awan Wibowo Laksono Poesoro and Tata Mustasya , Jakarta"
2005-03-04,The Jakarta Post,JKPOST,"Fuel price hikes: Short-term pain, long-term gain   
David E. Sumual , Jakarta"
2005-03-08,The Jakarta Post,JKPOST,"Fare to rise by between 6% and 15%  
Damar Harsanto , The Jakarta Post, Jakarta"
2005-03-09,The Jakarta Post,JKPOST,"Creating growth-linked bonds   
Robert J. Shiller , Project Syndicate"
2005-03-19,The Jakarta Post,JKPOST,"Rupiah will strengthen soon: BI   
The Jakarta Post , Jakarta"
2005-03-21,The Jakarta Post,JKPOST,"Excesses of regional autonomy hinder business   
P. Agung Pambudhi , Jakarta"
2005-03-28,The Jakarta Post,JKPOST,"Investor doubt grows with each protest   
Rendi A. Witular , The Jakarta Post, Jakarta"
2005-03-30,The Jakarta Post,JKPOST,"Bandung: Still a forum for innovative politics   
Adam Tyson , Leeds, Britain"
2005-04-01,The Jakarta Post,JKPOST,"RI has good chance of rating upgraded   
Urip Hudiono , The Jakarta Post, Jakarta"
2005-04-05,The Jakarta Post,JKPOST,"City OKs fare  subsidy  for monorail  
Damar Harsanto , The Jakarta Post, Jakarta"
2005-04-07,The Jakarta Post,JKPOST,"Indonesian  economy  to grow 5.5%, ADB says   
Urip Hudiono , The Jakarta Post, Jakarta"
2005-04-13,The Jakarta Post,JKPOST,"RI, China need better mutual understanding in trade, tourism   
The Jakarta Post , Jakarta"
2005-04-18,The Jakarta Post,JKPOST,"Investment to pick up: Experts  
Urip Hudiono , The Jakarta Post, Jakarta"
2005-04-25,The Jakarta Post,JKPOST,"Tax  reform could set off virtuous  economic  circle   
David E. Sumual , Jakarta"
2005-04-28,The Jakarta Post,JKPOST,"Communicating risks of disasters to insecure  public 
Ardimas Sasdi , Jakarta"
2005-05-07,The Jakarta Post,JKPOST,"Government issues crucial decree on land acquisition  
Muninggar Sri Saraswati and Rendi A. Witular , The Jakarta Post/Jakarta"
2005-05-09,The Jakarta Post,JKPOST,"Rising foreign investment driving RI's  economy 
The Jakarta Post , Asia News Network, Jakarta"
2005-05-19,The Jakarta Post,JKPOST,"The need to cooperate on oil  policy  in East Asia   
Makmur Keliat , Jakarta"
2005-05-20,The Jakarta Post,JKPOST,U.S. business wants to see RI facilitate investment
2005-05-25,The Jakarta Post,JKPOST,"Economy  strunggles over shaky political ground  
Umar Juoro , Jakarta"
2005-05-29,The Jakarta Post,JKPOST,"Life begins at 70 for batik designer Iwan Tirta  
Bruce Emond , The Jakarta Post, Jakarta"
2005-06-07,The Jakarta Post,JKPOST,"Part 2 of 2: The challenge of financing power projects   
Hardiv H Situmeang , Jakarta"
2005-06-07,The Jakarta Post,JKPOST,"Arbitration as mechanism to resolve disputes   
Budiono Kusumohamidjojo , Jakarta"
2005-06-09,The Jakarta Post,JKPOST,Revising the 2005  budget
2005-06-09,The Jakarta Post,JKPOST,"RI's  economy  hinges on drifting legal framework   
Umar Juoro , Jakarta"
2005-06-17,The Jakarta Post,JKPOST,"Letting go of past fictions, democracy without justice  
Ray Zulfirman Parsioan Pulungan , Jakarta"
2005-06-21,The Jakarta Post,JKPOST,"Acehnese  uncertain  about housing, work   
Annastashya Emmanuelle , Contributor, Aceh Besar"
2005-07-01,The Jakarta Post,JKPOST,"Cepu block settlement looks good, for the time being   
Dadan Wijaksana , The Jakarta Post, Jakarta"
2005-07-01,The Jakarta Post,JKPOST,"BI introduces new inflation scheme   
The Jakarta Post , Jakarta"
2005-07-02,The Jakarta Post,JKPOST,"Local govts urget to protect investor interests   
The central government has ordered local administrations to protect the interests of foreign investors by extending a helping hand to settle disputes, including those related to property ownership, said Vice President Jusuf Kalla."
2005-07-05,The Jakarta Post,JKPOST,"Jakartans start to feel the bite of fuel shortage  
The Jakarta Post , Jakarta, Kupang/Jambi"
2005-07-14,The Jakarta Post,JKPOST,"American, Indonesian businesses enjoy long-standing relations   
Rendi A. Witular , The Jakarta Post, Jakarta"
2005-07-16,The Jakarta Post,JKPOST,"RI's recovery boosts ASEAN's attractiveness   
Riyadi Suparno , The Jakarta Post/Kuala Lumpur"
2005-07-18,The Jakarta Post,JKPOST,"Development strategy, mental models and graft   
Awan Wibowo Laksono Poesoro and Indriyanto Seno Adji , Jakarta"
2005-07-25,The Jakarta Post,JKPOST,"Pay rise for legislators?   
Benget Simbolon Tnb. , Jakarta"
2005-07-25,The Jakarta Post,JKPOST,"New rule to stymie English teaching   
Hinton John Lowe , Bandung"
2005-08-04,The Jakarta Post,JKPOST,"Industrial estates await supportive regulations   
The Jakarta Post , Jakarta"
2005-08-05,The Jakarta Post,JKPOST,"ASEAN millennium development   
Romeo Austria Reyes, Jakarta"
2005-08-08,The Jakarta Post,JKPOST,"Government  policy  in Papua must be consistent  
Israr Iskandar , Jakarta"
2005-08-08,The Jakarta Post,JKPOST,"A good way to fight judicial corruption   
Frank Richardson , Norwich, UK"
2005-08-15,The Jakarta Post,JKPOST,Tightening money supply
2005-08-15,The Jakarta Post,JKPOST,MICE industry recovers after years in doldrums
2005-08-17,LKBN ANTARA,ANTARA,RI TO BOOST NATURAL RESOURCES-BASED EXPORTS
2005-08-19,The Jakarta Post,JKPOST,Budget  gives wrong signals
2005-08-19,The Jakarta Post,JKPOST,"Parta 1 of 2: The 2006 state  budget : Out of wonderland?   
Kahlil Rowter , Jakarta"
2005-08-20,The Jakarta Post,JKPOST,"Part 2 of 2: The 2006 state  budget : Out of wonderland?   
Kahlil Rowter , Jakarta"
2005-08-22,The Jakarta Post,JKPOST,"Govt completes draft  tax  laws   
Rendi A. Witular , The Jakarta Post, Jakarta"
2005-08-23,The Jakarta Post,JKPOST,"Unrealistic 2006  budget : The damage has been done   
David E. Sumual , Jakarta"
2005-08-24,The Jakarta Post,JKPOST,The beleaguered rupiah
2005-08-29,The Jakarta Post,JKPOST,Susilo's  economic policy
2005-08-30,The Jakarta Post,JKPOST,"Conflicting signals contribute to  uncertainty : Minister   
The Jakarta Post , Jakarta"
2005-09-01,The Jakarta Post,JKPOST,Temporary relief for rupiah
2005-09-05,The Jakarta Post,JKPOST,"Government gears up to bite the bullet  
Vincent Lingga , The  Jakarta Post, Jakarta"
2005-09-07,The Jakarta Post,JKPOST,"BI ups rate to defend rupiah   
The central bank has once again moved in to help the beleaguered rupiah -- while at the same time trying to ward off a looming inflation hike -- as it raised its interest rate to a double-digit level."
2005-09-07,The Jakarta Post,JKPOST,"Rupiah woos, who is to blame?"
2005-09-12,The Jakarta Post,JKPOST,"Legal certainty focus of  tax  draft   
Rendi A. Witular , The Jakarta Post, Jakarta"
2005-09-13,The Jakarta Post,JKPOST,"Activists  uncertain  over role of KKR   
Ridwan Max Sijabat , The Jakarta Post, Jakarta"
2005-10-04,Bisnis Indonesia,BISNIS,Inflation Rate May Reach 12 Percent
2005-10-04,The Jakarta Post,JKPOST,"Dual citizenship urged for mixed couples  
Hera Diani , The Jakarta Post, Jakarta"
2005-10-08,The Jakarta Post,JKPOST,"Uncertain  future ahead for international labor migration  
Santo Koesoebjono , Wasenaar, The Netherlands"
2005-10-08,The Jakarta Post,JKPOST,"Wrangling over Jakarta monorail bad for investment   
Yop Pandie , Jakarta"
2005-10-12,The Jakarta Post,JKPOST,"Part 2 of 2: Flushing away rent seekers and bureaucrats   
Evan Jones , Batam"
2005-10-13,The Jakarta Post,JKPOST,"Businesspeople concerned by govt  economic  performance  
The Jakarta Post , Jakarta"
2005-10-18,The Jakarta Post,JKPOST,"Externals blamed for bleak showing  
Rendi A. Witular , The Jakarta Post, Jakarta"
2005-10-19,The Jakarta Post,JKPOST,"Understanding  economic  theories   
Ari A. Perdana , Cambridge, Mass."
2005-10-27,The Jakarta Post,JKPOST,"Autonomy-seekers should keep focused   
I Wayan Ananta Wijaya , Contributor, Denpasar, Bali"
2005-10-28,The Jakarta Post,JKPOST,"Less-is-more philosophy would do our lawmakers good   
Benget Simbolon Tnb. , Jakarta"
2005-11-07,The Jakarta Post,JKPOST,"Danareksa to raise Rp 3t for infrastructure   
Rendi A. Witular , The Jakarta Post/Jakarta"
2005-11-07,The Jakarta Post,JKPOST,"'High royalties, high  taxes  not attractive to investors'"
2005-11-09,The Jakarta Post,JKPOST,"Global bird flu outbreak slows growth, says ADB  
Urip Hudiono , The Jakarta Post, Jakarta"
2005-11-15,The Jakarta Post,JKPOST,"The Constitutional Court: Don't let the sky fall in   
Mohamad Mova Al 'Afghani , Jakarta"
2005-11-17,LKBN ANTARA,ANTARA,SHIPPING COMPANIES DISAPPOINTED WITH INSA'S PROPOSED THC
2005-11-17,The Jakarta Post,JKPOST,"Govt must step up investment reforms  
Urip Hudiono , The Jakarta Post, Jakarta"
2005-11-18,LKBN ANTARA,ANTARA,PRESIDENT TO ISSUE INSTRUCTION TO REGULATE BUSINESS OF GOVT. OFFICIALS
2005-11-21,The Jakarta Post,JKPOST,"Indonesia needs big bang reform to woo investment   
Vincent Lingga , The Jakarta Post, Jakarta"
2005-11-29,The Jakarta Post,JKPOST,"Expansion continues despite stormy weather   
Rudijanto , Contributor, Jakarta"
2005-11-30,The Jakarta Post,JKPOST,Property for foreigners
2005-12-02,Bisnis Indonesia,BISNIS,Negotiation for Gas Supply for Kujang Meets Failure
2005-12-05,LKBN ANTARA,ANTARA,"|  
11TH ASEAN SUMMIT MUST BE REALISTIC IN CHOOSING COOPERATION PROGRAMS"
2005-12-05,The Jakarta Post,JKPOST,"Speculation of rift clouds reshuffle  
The Jakarta Post, Jakarta"
2005-12-07,The Jakarta Post,JKPOST,"The Cabinet reshuffle: Never too late to learn!  
J. Soedjati Djiwandono , Jakarta"
2005-12-09,The Jakarta Post,JKPOST,"SMEs: What have we done with this sector?  
C.G. Moghe , Jakarta"
2005-12-10,The Jakarta Post,JKPOST,"Business giants raise concern over rupiah  
Rendi A. Witular , The Jakarta Post/Jakarta"
2005-12-27,The Jakarta Post,JKPOST,"Investment climate still walking a tightrope  
Urip Hudiono , The Jakarta Post, Jakarta"
2005-12-27,The Jakarta Post,JKPOST,"Reform in  tax  regime not going anywhere   
Rendi A. Witular , The Jakarta Post, Jakarta"
2005-12-29,The Jakarta Post,JKPOST,"Loans, projects to spur growth   
Rendi A. Witular , The Jakarta Post, Jakarta"
2005-12-29,The Jakarta Post,JKPOST,"Vibrant visual arts scene encapsulates the soul  
Carla Bianpoen , Contributor, Jakarta"
2005-12-31,The Jakarta Post,JKPOST,"Government warns Freeport to stop polluting river  
Tb. Arie Rukmantara , The Jakarta Post, Jakarta"
2005-12-31,The Jakarta Post,JKPOST,"Building on today for the sake of the future  
David O'Brien , Jakarta"
2005-12-31,The Jakarta Post,JKPOST,"Maintain momentum to overcome challenges  
Stephen Schwartz , Jakarta"
2005-12-31,The Jakarta Post,JKPOST,"Weaker prospects ahead: Is oil to be blamed?  
Puspa Delima Amri , Jakarta"
2006-01-02,The Jakarta Post,JKPOST,"U.S. and RI: A strategic partnership  
Eric G. John , Washington D.C."
2006-01-02,The Jakarta Post,JKPOST,"Was 2005 a year of missed opportunities? Yes, says IPA chief   
The year that just ended saw global oil prices soar by about 40 percent during the course of the year. Yet, as its oil output continued to decline, Indonesia missed out on a potentially larger piece of the world's oil revenue. The president of the Indonesian Petroleum Association,   Chris Newton ,  shared his thoughts on how 2005 treated the domestic oil and gas sector with  The Jakarta Post's  Leony Aurora .  The following is an excerpt of the interview:"
2006-01-03,The Jakarta Post,JKPOST,"Govt plans crucial policies for 2006   
Rendi Akhmad Witular and Mustaqim , The Jakarta Post, Jakarta"
2006-01-19,The Jakarta Post,JKPOST,"Massive overhaul needed to root out graft in  tax  service  
Rendi Akhmad Witular , The Jakarta Post, Jakarta"
2006-01-26,LKBN ANTARA,ANTARA,GOVT BELIEVES JAPANESE INVESTORS TO LOOK AT INDONESIA AGAIN
2006-02-08,The Jakarta Post,JKPOST,"Protracted  uncertainty  leaves ports high and dry   
Rendi Akhmad Witular , The Jakarta Post, Jakarta"
2006-02-14,The Jakarta Post,JKPOST,Business-solution center
2006-02-17,The Jakarta Post,JKPOST,"Newmont, govt reach $30 million settlement  
Tb. Arie Rukmantara , The Jakarta Post, Jakarta"
2006-02-17,The Jakarta Post,JKPOST,"Govt plans new measures to improve investment climate   
The Jakarta Post , Jakarta"
2006-02-20,The Jakarta Post,JKPOST,"Dealing with the global jobs crisis   
Juan Somavia , Geneva"
2006-02-23,The Jakarta Post,JKPOST,"FDI approvals plunged in January   
The Jakarta Post , Jakarta"
2006-03-13,The Jakarta Post,JKPOST,"Natural resources sector needs govt attention   
Rendi Akhmad Witular , The Jakarta Post, Jakarta"
2006-03-13,The Jakarta Post,JKPOST,"Pornography bill a serious threat to artists  
A'an Suryana , The Jakarta Post, Jakarta"
2006-03-19,The Jakarta Post,JKPOST,"S'pore, RI negotiating Bintan management   
Rendi Akhmad Witular , The Jakarta Post, Batam"
2006-03-20,LKBN ANTARA,ANTARA,RI TO NEED RP716 TRILLION IN INVESTMENT TO REACH 5.7 PCT  ECONOMIC  GROWTH
2006-03-22,The Jakarta Post,JKPOST,"Govt sizes up ways to plug PLN  deficit 
The Jakarta Post , Jakarta, Bali"
2006-03-25,The Jakarta Post,JKPOST,"Protests not xenophobic: Boediono   
The Jakarta Post , Jakarta"
2006-03-29,The Jakarta Post,JKPOST,"Tussle ahead over labor law   
The Jakarta Post , Jakarta"
2006-03-31,The Jakarta Post,JKPOST,"Indonesia reappears on investors' radar screen   
Bali played host to the Second Indonesian Investment Forum last week, which brought together 700 foreign and local investors, and executives from international finance agencies to look at investment opportunities in Indonesia. To learn how foreign investors view the country,  The Jakarta Post's  Rita A. Widiadana   spoke with   Sheldon Trainor ,  head of Asia Investment Banking for Merrill Lynch. The following are excerpts of the interview."
2006-04-07,The Jakarta Post,JKPOST,"ADB forecasts RI growth slowdown due to high inflation  
Urip Hudiono , The Jakarta Post, Jakarta"
2006-04-08,LKBN ANTARA,ANTARA,PRESIDENT: GOVT- PUBLIC  PRIVATE PARTNERSHIP KEY STRATEGY TO ATTRACT INVESTORS
2006-04-13,The Jakarta Post,JKPOST,"New law to bring issuance of local  taxes  into line   
Urip Hudiono , The Jakarta Post, Jakarta"
2006-04-15,The Jakarta Post,JKPOST,"Death sentence not a solution but a problem  
Frans H. Winarta , Jakarta"
2006-04-18,Bisnis Indonesia,BISNIS,Minister of Finance: It is Difficult to Have  Economic  Growth of 6.2%
2006-04-24,The Jakarta Post,JKPOST,"Three million commuters make traffic even worse   
Adianto P. Simamora , The Jakarta Post, Jakarta"
2006-04-27,The Jakarta Post,JKPOST,The oil crunch
2006-05-01,The Jakarta Post,JKPOST,Uncalled for demonstrations
2006-05-01,The Jakarta Post,JKPOST,"Darmin faces tough job reforming  tax  office   
Rendi Akhmad Witular , The Jakarta Post, Jakarta"
2006-05-04,The Jakarta Post,JKPOST,"'Sharia-based bylaws violate Constitution'  
Tangerang is firmly in the spotlight after the issuance of a controversial bylaw to eradicate prostitution in the municipality. It also issued another bylaw that bans liquor.   Syafi'i Anwar  , executive director of the International Centre for Islam and Pluralism (ICIP), shared his views with  The Jakarta Post's    Ridwan Max Sijabat   on what is happening in the region."
2006-05-06,The Jakarta Post,JKPOST,"Regions told to streamline investment regulations   
Benget Simbolon Tnb. , The Jakarta Post, Jakarta"
2006-05-11,The Jakarta Post,JKPOST,"Outsourcing still 'slavery' to unions  
Ridwan Max Sijabat , The Jakarta Post, Jakarta"
2006-05-19,The Jakarta Post,JKPOST,"Part 1 of 2: Democracy requires new strategies   
Wisaksono Noeradi , Jakarta"
2006-05-22,The Jakarta Post,JKPOST,"Policy -making changes in the era of 'reformasi'  
Kahlil Rowter , Jakarta"
2006-05-24,The Jakarta Post,JKPOST,"Employment growth and changing market demands  
Winarno Zain , Jakarta"
2006-05-29,The Jakarta Post,JKPOST,"President's plan to form new  economic  task force slammed  
The Jakarta Post , Jakarta"
2006-06-01,LKBN ANTARA,ANTARA,DUTCH BUSINESSMEN TO INVEST IN INDONESIA
2006-06-05,The Jakarta Post,JKPOST,"Financial markets await direction of U.S. rates  
The Jakarta Post , Jakarta"
2006-06-11,The Jakarta Post,JKPOST,"Helping tsunami survivors without land  
Muamar Vebry, Contributor, Banda Aceh"
